Lens ID,Title,Date Published,Publication Year,Publication Type,Source Title,ISSNs,Publisher,Source Country,Author/s,Abstract,Volume,Issue Number,Start Page,End Page,Fields of Study,Keywords,MeSH Terms,Chemicals,Funding,Source URLs,External URL,PMID,DOI,Microsoft Academic ID,PMCID,Patent Citation Count,References,Scholarly Citation Count
034-937-628-469-063,Expressive bibliography: Personal collections in public space,2011-07-20,2011,journal article,Knowledge Organization,09437444,International Society for Knowledge Organization,Germany,Melanie Feinberg,"This paper examines collections of citations that individual users contribute to social tagging systems such as De licious and LibraryThing. I characterize these personal collections, furnished with various forms of metadata and arranged for Web display, as a means of communication, where a particular sensibility molds guiding principles for resource selection, description, and categorization. Using several analytic frameworks from museum studies, I present three brief case studies that interrogate both the substance and the means of expression achieved in such collections, which I term ""expressive bibliographies."" In considering these case studies, I explore how an explicit rhetorical perspective might inform purposeful design of expressive bibliography.",38,2,123,134,World Wide Web; Sociology; Rhetorical question; Sensibility; Guiding Principles; Public space; Museology; Metadata; Categorization; Bibliography,,,,,https://utexas.influuent.utsystem.edu/en/publications/expressive-bibliography-personal-collections-in-public-space https://researchers.dellmed.utexas.edu/en/publications/expressive-bibliography-personal-collections-in-public-space http://cat.inist.fr/?aModele=afficheN&cpsidt=24274263 http://dx.doi.org/10.5771/0943-7444-2011-2-123 https://uncch.pure.elsevier.com/en/publications/expressive-bibliography-personal-collections-in-public-space,http://dx.doi.org/10.5771/0943-7444-2011-2-123,,10.5771/0943-7444-2011-2-123,2521593815,,0,,5
035-026-693-423-95X,Tagging and Sexual Boundaries,,2012,journal article,Knowledge Organization,09437444,International Society for Knowledge Organization,Germany,Patrick Keilty,,39,5,320,324,Computer science,,,,,http://dx.doi.org/10.5771/0943-7444-2012-5-320,http://dx.doi.org/10.5771/0943-7444-2012-5-320,,10.5771/0943-7444-2012-5-320,2810999667,,0,,6
035-098-386-679-456,ISKO News,,2010,journal article,KNOWLEDGE ORGANIZATION,09437444,Nomos Verlag,,,,37,1,88,88,,,,,,,http://dx.doi.org/10.5771/0943-7444-2010-1-88,,10.5771/0943-7444-2010-1-88,,,0,,0
035-628-078-643-625,,,2010,journal issue,KNOWLEDGE ORGANIZATION,09437444,Nomos Verlag,,,,37,4,,,,,,,,,http://dx.doi.org/10.5771/0943-7444-2010-4,,10.5771/0943-7444-2010-4,,,0,,0
035-806-899-784-539,"Boundary Objects: CWA, an HR Firm, and Emergent Vocabulary",,2013,journal article,KNOWLEDGE ORGANIZATION,09437444,Nomos Verlag,,Christine Marchese; Richard P. Smiraglia,,40,4,254,259,,,,,,,http://dx.doi.org/10.5771/0943-7444-2013-4-254,,10.5771/0943-7444-2013-4-254,,,0,,3
036-112-872-198-88X,Metadata Standard of Theses and Dissertations according to the Entity-Relationship Model,,2009,journal article,Knowledge Organization,09437444,International Society for Knowledge Organization,Germany,Cíntia de Azevedo Lourenço; Lídia Alvarenga,,36,1,30,45,Entity–relationship model; Information retrieval; Metadata standard; Computer science,,,,,http://dx.doi.org/10.5771/0943-7444-2009-1-30,http://dx.doi.org/10.5771/0943-7444-2009-1-30,,10.5771/0943-7444-2009-1-30,2894321273,,0,,0
036-468-786-829-005,"Conference ISKO-France, 10-1 October 2013, Paris. Contexts, languages and cultures in knowledge organization",,2013,journal article,KNOWLEDGE ORGANIZATION,09437444,Nomos Verlag,,,,40,2,147,147,,,,,,,http://dx.doi.org/10.5771/0943-7444-2013-2-147,,10.5771/0943-7444-2013-2-147,,,0,,0
036-804-536-014-962,ISKO News,,2010,journal article,KNOWLEDGE ORGANIZATION,09437444,Nomos Verlag,,,,37,2,149,150,,,,,,,http://dx.doi.org/10.5771/0943-7444-2010-2-149,,10.5771/0943-7444-2010-2-149,,,0,,0
036-914-604-793-185,Semantic warrant: A pivotal concept for our field,2010-12-01,2010,journal article,Knowledge Organization,09437444,International Society for Knowledge Organization,Germany,Barbara H. Kwaśnik,,37,2,106,110,Warrant; Computer science; Knowledge management,,,,,https://experts.syr.edu/en/publications/semantic-warrant-a-pivotal-concept-for-our-field,http://dx.doi.org/10.5771/0943-7444-2010-2-106,,10.5771/0943-7444-2010-2-106,2592460315,,0,,4
037-133-053-471-685,Titelei/Inhaltsverzeichnis,,2013,journal article,KNOWLEDGE ORGANIZATION,09437444,Nomos Verlag,,,,40,6,361,362,,,,,,,http://dx.doi.org/10.5771/0943-7444-2013-6-361,,10.5771/0943-7444-2013-6-361,,,0,,0
039-572-877-788-682,"In the margins: Reflections on scribbles, knowledge organization, and access",2011-11-04,2011,journal article,Knowledge Organization,09437444,International Society for Knowledge Organization,Germany,June Abbas,"Extended abstract: A favored text, dog-eared and yellowed from use, yet still useful, brings back insights that we try to impart to our students when we teach knowledge organization, organization and control of recorded information courses, whichever words we have chosen to label them. Scribbled in the margins 1 are notes to self, keywords, subject headings? “tags”? to remind us of why this particular passage was relevant to us. These scribbles include notes about the thoughts, subjects, eloquent linguistics that we wish to remember, and to access at a later time, maybe even our thoughts that occurred as we read the words. Should someone pick up this same text and read the passages and also the notes, would one necessarily draw the same conclusions, or would one have yet other insights into the author’s meanings, the scribbles, the words? 2 Wilson (1968) reminds us that “What a text says is not necessarily what it reveals or",34,2,72,77,Epistemology; Social perception; Library science; Political science; Knowledge organization; Wish; Markup language; Social network,,,,,https://journals.lib.washington.edu/index.php/nasko/article/view/12840/11321 http://journals.lib.washington.edu/index.php/nasko/article/download/12840/11321,https://journals.lib.washington.edu/index.php/nasko/article/view/12840/11321,,,2127533814,,0,006-955-189-054-870; 008-536-386-002-590; 026-941-472-226-357; 032-406-821-828-19X; 049-360-584-178-088; 055-651-513-963-860; 057-520-051-076-011; 059-438-671-773-803; 063-882-868-432-776; 075-634-399-629-869; 080-946-644-581-699; 092-736-012-017-002; 100-275-497-757-20X; 104-189-967-884-487; 110-729-042-613-564; 158-560-649-219-636; 161-752-846-263-489; 190-305-663-119-676,2
039-890-704-429-132,The Impossible Decision: Social Tagging and Derrida’s Deconstructed Hospitality,2013-10-31,2013,journal article,Knowledge Organization,09437444,International Society for Knowledge Organization,Germany,Melodie J. Fox; Austin Reece,"Social tagging has been lauded for providing a voice of the user community, free of restrictions dictated by knowledge organization standards for subject access. Tagging allows many perspectives to be represented, but at what cost? Using deconstruction, Derrida argues that absolute hospitality is required to ensure justice for access and inclusiveness; however, the consequence becomes that the host becomes hostage to the other. In this ongoing research, we explore the Derridean concept of hospitality as it relates to social tagging, examining the consequences of unconditional inclusiveness, the process of discerning constraints to hospitality in order to interpret different kinds of ""otherness""—or what Derrida (2000, 75) calls the ""impossible"" decision—and what mitigation means, using the social tagging environment to illustrate.",4,1,53,69,Hospitality; Epistemology; Deconstruction; Sociology; Social exclusion; Subject access; Knowledge organization; Public relations,,,,,http://journals.lib.washington.edu/index.php/nasko/article/download/14645/12289 http://journals.lib.washington.edu/index.php/nasko/article/view/14645,http://dx.doi.org/10.7152/nasko.v4i1.14645,,10.7152/nasko.v4i1.14645,2021504714,,0,,2
040-208-896-050-485,OntoPhoto and the Role of Ontology in Organizing Knowledge,,2011,journal article,Knowledge Organization,09437444,International Society for Knowledge Organization,Germany,Allen C. Benson,"This article is concerned with ontology and its applications in Knowledge Organization (KO) activities. Connec- tions are drawn between efforts in artificial intelligence (AI) to capture the meaning of information and make it accessible to machines and the efforts made in libraries to use KO tools in machine-based record building and search and retrieval systems. The practices used in AI that are of interest here include ontology and ontology-based knowledge representation. In this article their applications in KO are directed towards a particularly problematic document type—the photograph. There are two argu- ments motivating this article. First, ontology-based KO systems that join AI techniques with library cataloging practices make it possible to utilize higher levels of expressivity when describing photographs. Second, KO systems for photographs that are capable of reasoning over concepts and relationships can potentially provide richer, more relevant search results than systems utilizing word-matching alone.",38,2,79,95,World Wide Web; Knowledge representation and reasoning; Ontology (information science); Ontology; Knowledge organization; Computer science; Library catalog; Expressivity,,,,,http://www.star-host.com/OntoPhoto.pdf,http://dx.doi.org/10.5771/0943-7444-2011-2-79,,10.5771/0943-7444-2011-2-79,2514172930,,0,021-736-440-602-931; 025-929-743-572-676; 026-712-844-452-082; 026-787-086-442-120; 032-412-066-177-119; 046-870-323-010-229; 048-347-999-836-422; 051-869-706-830-737; 053-180-165-944-442; 060-543-292-212-918; 069-912-821-468-387; 071-603-002-923-860; 072-559-753-492-492; 100-935-111-075-54X; 108-881-422-982-85X; 117-516-248-698-589; 142-429-227-545-138; 146-494-787-462-687; 148-477-553-142-347; 161-271-744-129-759; 161-579-608-646-365; 171-308-985-462-228; 180-118-751-642-014,4
040-444-916-158-659,Titelei/Inhaltsverzeichnis,,2013,journal article,KNOWLEDGE ORGANIZATION,09437444,Nomos Verlag,,,,40,5,281,282,,,,,,,http://dx.doi.org/10.5771/0943-7444-2013-5-281,,10.5771/0943-7444-2013-5-281,,,0,,0
040-711-244-340-047,Research on Automatic Classification of Documents in Library Environment: A Literature Review,,2013,journal article,Knowledge Organization,09437444,International Society for Knowledge Organization,Germany,Sanjay K. Desale; Rajendra Kumbhar,,40,5,295,304,Information retrieval; Computer science,,,,,http://dx.doi.org/10.5771/0943-7444-2013-5-295,http://dx.doi.org/10.5771/0943-7444-2013-5-295,,10.5771/0943-7444-2013-5-295,2809716804,,0,,1
041-757-417-166-519,New Roles and Global Agents in Information Organization in Spanish Libraries,,2012,journal article,Knowledge Organization,09437444,International Society for Knowledge Organization,Germany,Daniel Martínez-Ávila; Hope A. Olson; and Margaret E.I. Kipp,,39,2,125,136,Business; Knowledge management,,,,,http://dx.doi.org/10.5771/0943-7444-2012-2-125,http://dx.doi.org/10.5771/0943-7444-2012-2-125,,10.5771/0943-7444-2012-2-125,2811096798,,0,,3
042-498-034-714-437,Index to Volume 35,,2009,journal article,KNOWLEDGE ORGANIZATION,09437444,Nomos Verlag,,,,36,1,80,80,,,,,,,http://dx.doi.org/10.5771/0943-7444-2009-1-80,,10.5771/0943-7444-2009-1-80,,,0,,0
042-508-303-375-784,Brian Vickery 11th Sept. 1918-17th Oct. 2009,,2010,journal article,KNOWLEDGE ORGANIZATION,09437444,Nomos Verlag,,,,37,3,155,156,,,,,,,http://dx.doi.org/10.5771/0943-7444-2010-3-155,,10.5771/0943-7444-2010-3-155,,,0,,0
043-251-321-340-134,"Archival Context, Digital Content, and the Ethics of Digital Archival Representation",,2012,journal article,Knowledge Organization,09437444,International Society for Knowledge Organization,Germany,Jane Zhang,"The findings of a recent study on digital archival representation raise some ethical concerns about how digital archival materials are organized, described, and made available for use on the Web. Archivists have a fundamental obligation to preserve and protect the authenticity and integrity of records in their holdings and, at the same time, have the responsibility to promote the use of records as a fundamental purpose of the keeping of archives (SAA 2005 Code of Ethics for Archivists V & VI). Is it an ethical practice that digital content in digital archives is deeply embedded in its contextual structure and generally underrepresented in digital archival systems? Similarly, is it ethical for archivists to detach digital items from their archival context in order to make them more ""digital friendly"" and more accessible to meet needs of some users? Do archivists have an obligation to bring the two representation systems together so that the context and content of digital archives can be better represented and archival materials ""can be located and used by anyone, for any purpose, while still remaining authentic evidence of the work and life of the creator""? (Millar 2010, 157) This paper discusses the findings of the study and their ethical implications relating to digital archival description and representation.",39,5,332,339,Ethical code; Library science; Archival research; Obligation; Digital content; Digital Archives; Ethical concerns; Ethical practice; Computer science; Archival science,,,,,http://dx.doi.org/10.5771/0943-7444-2012-5-332 http://cat.inist.fr/?aModele=afficheN&cpsidt=26838808,http://dx.doi.org/10.5771/0943-7444-2012-5-332,,10.5771/0943-7444-2012-5-332,2248350562,,0,,2
043-486-192-359-539,Impressum,,2009,journal article,KNOWLEDGE ORGANIZATION,09437444,Nomos Verlag,,,,36,2-3,184,185,,,,,,,http://dx.doi.org/10.5771/0943-7444-2009-2-3-184,,10.5771/0943-7444-2009-2-3-184,,,0,,0
043-550-610-510-777,The Spatial Value of Information,,2013,journal article,Knowledge Organization,09437444,International Society for Knowledge Organization,Germany,Agnese Galeffi,,40,3,182,186,Statistics; Computer science; Value of information,,,,,http://dx.doi.org/10.5771/0943-7444-2013-3-182,http://dx.doi.org/10.5771/0943-7444-2013-3-182,,10.5771/0943-7444-2013-3-182,2810260916,,0,,1
044-023-593-835-730,Revealing Interdisciplinarity in Nanoscience and Technology Queries: A Transaction Log Analysis Approach,,2011,journal article,Knowledge Organization,09437444,International Society for Knowledge Organization,Germany,Ali Shiri,"The study reported here investigated the search behaviour patterns of nanoscience and nanotechnology searchers as revealed by transaction log analysis of the NANOnetBASE electronic book digital library. This paper examines the patterns and strategies of nano searchers' query formulation and reformulation, then explores the extent of interdisciplinarity in search queries using the INSPEC and Compendex thesauri. The results show certain query formulation patterns associated with searching in an emerging and interdisciplinary area of nanotechnology such as: the use of multiword and compound query terms, extensive use of search terms beginning with the prefix ""nano,"" hyphenated terms, spelling variations, a large number of query reformulations, and the use of acronyms. The results also indicate that 62% of the unique top terms resulting from mapping users' query terms to the INSPEC Classification codes represented two or more disciplines, specifically terms associated with the Classification code ""A"" representing ""physics."" The results have implications for information organization and representation, user interface design and federated searching in digital libraries and multi-subject databases.",38,2,135,153,Web query classification; Prefix; User interface design; Web search query; Nanotechnology; Query language; Information retrieval; Inspec; Computer science; Digital library; Query expansion,,,,,http://dx.doi.org/10.5771/0943-7444-2011-2-135 http://cat.inist.fr/?aModele=afficheN&cpsidt=24274264,http://dx.doi.org/10.5771/0943-7444-2011-2-135,,10.5771/0943-7444-2011-2-135,2522756835,,0,,3
044-157-700-896-779,Titelei/Inhaltsverzeichnis,,2012,journal article,KNOWLEDGE ORGANIZATION,09437444,Nomos Verlag,,,,39,4,231,232,,,,,,,http://dx.doi.org/10.5771/0943-7444-2012-4-231,,10.5771/0943-7444-2012-4-231,,,0,,0
044-255-306-397-145,"I Simposio Internacional sobre Organizacion del Conocimiento, Bibliotecologia y Terminologia: An Editorial",,2011,journal article,Knowledge Organization,09437444,International Society for Knowledge Organization,Germany,Richard P. Smiraglia,,38,1,3,8,Computer science,,,,,http://cat.inist.fr/?aModele=afficheN&cpsidt=24295658 http://dx.doi.org/10.5771/0943-7444-2011-1-3,http://dx.doi.org/10.5771/0943-7444-2011-1-3,,10.5771/0943-7444-2011-1-3,2525177650,,0,,1
044-336-702-735-219,Reader-Interest Classification: Concept and Terminology Historical Overview,,2013,journal article,Knowledge Organization,09437444,International Society for Knowledge Organization,Germany,Daniel Martínez-Ávila; Rosa San Segundo,,40,2,102,114,Computer science; Linguistics; Terminology,,,,,http://dx.doi.org/10.5771/0943-7444-2013-2-102,http://dx.doi.org/10.5771/0943-7444-2013-2-102,,10.5771/0943-7444-2013-2-102,2810975990,,0,,2
044-758-727-283-861,Titelei/Inhaltsverzeichnis,,2010,journal article,KNOWLEDGE ORGANIZATION,09437444,Nomos Verlag,,,,37,1,I,II,,,,,,,http://dx.doi.org/10.5771/0943-7444-2010-1-i,,10.5771/0943-7444-2010-1-i,,,0,,0
045-419-303-088-35X,Treatment of Georeferencing in Knowledge Organization Systems: North American Contributions to Integrated Georeferencing,2011-11-04,2011,journal article,Knowledge Organization,09437444,International Society for Knowledge Organization,Germany,Olha Buchel; Linda L. Hill,,2,1,47,57,Geography; Information retrieval; Data science; Software; Knowledge organization; Geographic information system; Georeference,,,,,https://journals.lib.washington.edu/index.php/nasko/article/download/12807/11289 http://journals.lib.washington.edu/index.php/nasko/article/view/12807/11289 http://arizona.openrepository.com/arizona/handle/10150/105729,http://dx.doi.org/10.7152/nasko.v2i1.12807,,10.7152/nasko.v2i1.12807,2042067532,,0,034-762-675-730-242; 071-176-047-886-027; 074-235-327-792-347; 084-896-306-427-907; 089-066-158-989-922; 089-136-348-811-720; 102-220-971-627-387; 129-741-152-159-341; 155-029-556-449-197; 170-256-158-174-46X,6
045-753-152-066-148,Classification Issues in 2008.,,2010,journal article,Knowledge Organization,09437444,International Society for Knowledge Organization,Germany,Nancy J. Williamson,,37,4,318,331,Data science; Computer science,,,,,http://dx.doi.org/10.5771/0943-7444-2010-4-318,http://dx.doi.org/10.5771/0943-7444-2010-4-318,,10.5771/0943-7444-2010-4-318,2915688231,,0,,0
046-166-783-595-53X,Image Retrieval: A Comparative Study on the Influence of Indexing Vocabularies,,2009,journal article,Knowledge Organization,09437444,International Society for Knowledge Organization,Germany,Elaine Ménard,,36,4,200,213,Image retrieval; Information retrieval; Computer science; Search engine indexing,,,,,http://dx.doi.org/10.5771/0943-7444-2009-4-200,http://dx.doi.org/10.5771/0943-7444-2009-4-200,,10.5771/0943-7444-2009-4-200,2894107798,,0,,7
047-968-826-962-696,"The Disorder of Things: Metaphysical Foundations of the Disunity of Science by John Dupré. Massachusetts; London: Harvard University Press, 1993, 308p. ISBN0-674-21261-4 (Hb); and Human Nature and the Limits of Science by John Dupré. Oxford; New York: Oxford University Press, 2001, 201p. ISBN 0-19-926550-X (Pb)",,2013,journal article,KNOWLEDGE ORGANIZATION,09437444,Nomos Verlag,,,,40,2,149,153,,,,,,,http://dx.doi.org/10.5771/0943-7444-2013-2-149,,10.5771/0943-7444-2013-2-149,,,0,,0
048-107-503-236-974,"Developing and Maintaining a National Classification System, Experience from Korean Decimal Classification",,2012,journal article,Knowledge Organization,09437444,International Society for Knowledge Organization,Germany,Dong-Geun Oh,"Korean Decimal Classification (KDC) is described. KDC is a standard classification system officially published and maintained by the Korean Library Association. After tracing a brief history of modern classification in South Korea, we examine various characteristics and problems of KDC in detail, including the social context of developing it, its usage in the Korean libraries, the influences of other classifications on the system, characteristics of the schedule and major tables, and its newest edition (5 th ed.). We make eight suggestions and recommendations for future development of KDC, in particular, and for the development and maintenance of unique national classification, in general, based on experience in South Korea.",39,2,72,82,Social environment; Library science; Korean decimal classification; National system; Computer science,,,,,http://dx.doi.org/10.5771/0943-7444-2012-2-72 http://cat.inist.fr/?aModele=afficheN&cpsidt=25722166,http://dx.doi.org/10.5771/0943-7444-2012-2-72,,10.5771/0943-7444-2012-2-72,2472064870,,0,,2
048-127-750-639-998,UDC and folksonomies,,2010,journal article,Knowledge Organization,09437444,International Society for Knowledge Organization,Germany,Alenka Šauperl,"Social tagging systems, known as ‘folksonomies’, represent an important part of web resource discovery as they enable free and unrestricted browsing through information space. Folksonomies consisting of subject designators (tags) assigned by users, however, have one important drawback: they do not express semantic relationships either hierarchical or associative between tags. As a consequence, the use of tags to browse information resources requires moving from one resource to another, based on coincidence and not on the pre-established meaningful or logical connections that may exist between related resources. We suggest that the semantic structure of the Universal Decimal Classification (UDC) may be used in complementing and supporting tag-based browsing. In this work, two specific questions were investigated: (1) Are terms used as tags in folksonomies included in the UDC? and (2) Which facets of UDC match the characteristics of documents or information objects that are tagged in folksonomies? A collection of the most popular tags from Amazon, LibraryThing, Delicious and 43Things was investigated. The universal nature of UDC was examined through the universality of topics and facets covering diverse human interests which are at the same time interconnected and form a rich and intricate semantic structure. The results suggest that UDC-supported folksonomies could be implemented in resource discovery, in particular in library portals and catalogues.",37,4,307,317,Universality (philosophy); World Wide Web; Associative property; Universal Decimal Classification; Information retrieval; Information space; Folksonomy; Drawback; Computer science; Web resource,,,,,https://arizona.openrepository.com/handle/10150/198790 http://dx.doi.org/10.5771/0943-7444-2010-4-307 https://arizona.openrepository.com/bitstream/10150/198790/1/Sauperl_E%26C31_2009.pdf https://repository.arizona.edu/arizona/handle/10150/198790 https://repository.arizona.edu/bitstream/10150/198790/1/Sauperl_E%26C31_2009.pdf,http://dx.doi.org/10.5771/0943-7444-2010-4-307,,10.5771/0943-7444-2010-4-307,575501979,,0,011-981-882-161-607; 083-119-821-288-742; 160-068-302-690-610,2
049-650-353-682-354,,,2010,journal issue,KNOWLEDGE ORGANIZATION,09437444,Nomos Verlag,,,,37,2,,,,,,,,,http://dx.doi.org/10.5771/0943-7444-2010-2,,10.5771/0943-7444-2010-2,,,0,,0
049-817-347-500-704,,,2009,journal issue,KNOWLEDGE ORGANIZATION,09437444,Nomos Verlag,,,,36,4,,,,,,,,,http://dx.doi.org/10.5771/0943-7444-2009-4,,10.5771/0943-7444-2009-4,,,0,,0
050-104-162-951-096,Interrogating “Identity”: A Philosophical Approach to an Enduring Issue in Knowledge Organization,,2009,journal article,Knowledge Organization,09437444,International Society for Knowledge Organization,Germany,Jonathan Furner,,36,1,3,16,Epistemology; Philosophical methodology; Sociology; Knowledge organization,,,,,http://dx.doi.org/10.5771/0943-7444-2009-1-3,http://dx.doi.org/10.5771/0943-7444-2009-1-3,,10.5771/0943-7444-2009-1-3,2893194050,,0,,6
051-228-697-962-243,,,2009,journal issue,KNOWLEDGE ORGANIZATION,09437444,Nomos Verlag,,,,36,1,,,,,,,,,http://dx.doi.org/10.5771/0943-7444-2009-1,,10.5771/0943-7444-2009-1,,,0,,0
051-310-445-177-540,Classifications. On Philosophers and Librarians,,2009,journal article,Knowledge Organization,09437444,International Society for Knowledge Organization,Germany,Cristiana Bettella; Massimiliano Carrara,,36,2-3,88,91,Epistemology; Philosophy,,,,,http://dx.doi.org/10.5771/0943-7444-2009-2-3-88,http://dx.doi.org/10.5771/0943-7444-2009-2-3-88,,10.5771/0943-7444-2009-2-3-88,2893842574,,0,,0
051-455-719-730-276,"Semantics, Classifications and Evidence in a Model for Global Catastrophic Risks",2012-01-01,2012,journal article,Knowledge Organization,09437444,,,Klaus Solberg Søilen; Philip B. Alipour,"Life on the surface of the Earth is fragile and can be deteriorated by outside influence, from nature, or inside influence, from humans. We present a macro perspective for the nation state as a kno ...",38,5,438,454,Semantics; Business; Macro; Nation state; Catastrophic risk; Socioeconomics; Economic system,,,,,http://www.diva-portal.org/smash/record.jsf?pid=diva2:534874,http://www.diva-portal.org/smash/record.jsf?pid=diva2:534874,,,1582287621,,0,,3
