Lens ID,Title,Date Published,Publication Year,Publication Type,Source Title,ISSNs,Publisher,Source Country,Author/s,Abstract,Volume,Issue Number,Start Page,End Page,Fields of Study,Keywords,MeSH Terms,Chemicals,Funding,Source URLs,External URL,PMID,DOI,Microsoft Academic ID,PMCID,Patent Citation Count,References,Scholarly Citation Count
000-108-273-351-151,"Eliminate, Abandon, Dismantle: Cataloging in Library Consultant Reports",,2012,journal article,Knowledge Organization,09437444,International Society for Knowledge Organization,Germany,Tina Gross,,39,5,398,402,Library science; Political science; Cataloging,,,,,http://dx.doi.org/10.5771/0943-7444-2012-5-398,http://dx.doi.org/10.5771/0943-7444-2012-5-398,,10.5771/0943-7444-2012-5-398,2811384953,,0,,0
001-254-322-670-872,Why public libraries in sweden did nor choose Dewey.,2010-01-01,2010,journal article,Knowledge Organization,09437444,,,Joacim Hansson,"The article identifies two distinct sections, one within the public library sphere and one in academic libraries, relevant for the development of a unique Swedish classification system (the SAB-system) to be used in public libraries. These are used to analyse the social and discursive influences that led to a rejection of the DDC as the common classification system for the public libraries in Sweden. The author analyses the debate that took place in the 1910s in various publications and identifies theoretical as well as some practical reasons for rejecting the DDC. Reference is also made to the situation in Norway and Denmark at this time and their attempts to influence Sweden to accept the DDC as had been done in these countries. Conclusions are drawn that the reasons for rejection of the DDC not only is to be sought in theoretical or even practical problems regarding the system itself but in the academic library sector which, through the SAB-system, could create a lasting influence on the knowledge organisation in public libraries in order to uphold the national identity of the Swedish library system",24,3,145,153,Sociology; Library science; Library classification; Disadvantage; National identity; Academic library; Knowledge organisation,,,,,http://www.diva-portal.org/smash/record.jsf?pid=diva2:292515,http://www.diva-portal.org/smash/record.jsf?pid=diva2:292515,,,392260780,,0,,1
001-542-585-753-06X,Designing a Thesaurus to Give Visibility to the Historical Archives in the Archivo del Reino in Valencia,,2011,journal article,Knowledge Organization,09437444,International Society for Knowledge Organization,Germany,Vicent Gimenez-Chornet; Mercedes Escrig-Gimenez,"This article describes the process of constructing a thesaurus based on original historical documents located in the Archivo del Reino de Valencia, one of the most important historical archives in Spain. After examining precedents, we discuss the methodology used and its application. The aim of the project was to provide visibility to information contained in these historical documents which would otherwise have remained inaccessible and to do so in the clearest, most rigorous, and most useful way possible for both the specialized user and the general public. The use of information technology as a management tool is not as common in archives, especially historical archives, as in other documentation areas such as libraries. A pilot project was therefore set up to create an intranet support for managing four specific historical archives containing documents dating from the 13 th to the 20 th centuries. The most important part of this project was that of exploring the viability of constructing a thesaurus to become part of the automated program for archive description and checking.",38,2,153,166,Information technology; Visibility; Engineering; World Wide Web; Library science; Intranet; Management tool; Documentation,,,,,http://cat.inist.fr/?aModele=afficheN&cpsidt=24274265 http://dx.doi.org/10.5771/0943-7444-2011-2-154,http://dx.doi.org/10.5771/0943-7444-2011-2-154,,10.5771/0943-7444-2011-2-154,2524040766,,0,,2
001-567-105-453-238,Classical Pragmatism and its Varieties: On a Pluriform Metatheoretical Perspective for Knowledge Organization,2011-11-04,2011,journal article,Knowledge Organization,09437444,International Society for Knowledge Organization,Germany,Thomas M. Dousa,,2,1,1,9,Epistemology; Sociology; Pragmatism; Ontology; Knowledge organization,,,,,https://arizona.openrepository.com/handle/10150/105796 http://journals.lib.washington.edu/index.php/nasko/article/download/12809/11291 https://journals.lib.washington.edu/index.php/nasko/article/view/12809,http://dx.doi.org/10.7152/nasko.v2i1.12809,,10.7152/nasko.v2i1.12809,2005694311,,0,000-409-067-561-341; 007-716-747-884-19X; 015-837-299-432-202; 020-818-564-135-012; 028-840-925-321-913; 030-052-392-380-99X; 035-067-074-481-289; 039-605-397-004-920; 044-939-394-642-346; 047-173-765-684-08X; 054-056-383-970-604; 080-945-058-659-719; 083-796-388-370-769; 086-189-392-125-955; 086-947-696-709-087; 092-443-662-293-245; 108-745-962-125-027; 123-890-024-105-075; 125-035-556-405-293; 145-927-183-875-127; 154-209-198-838-441; 159-175-579-458-417; 167-219-482-137-774; 190-805-304-109-100; 194-391-518-246-985; 195-539-028-993-237,5
001-740-487-901-126,"Publication of ISO 25964-2, the standard for interoperability of thesauri",,2013,journal article,KNOWLEDGE ORGANIZATION,09437444,Nomos Verlag,,,,40,2,147,148,,,,,,,http://dx.doi.org/10.5771/0943-7444-2013-2-147-1,,10.5771/0943-7444-2013-2-147-1,,,0,,0
002-351-310-733-62X,Developing a Metadata Element Set for Organizing Literary Works: A Survey of the American Literary Community,,2011,journal article,Knowledge Organization,09437444,International Society for Knowledge Organization,Germany,Stephen Paling,,38,3,262,277,World Wide Web; Sociology; Metadata element,,,,,http://dx.doi.org/10.5771/0943-7444-2011-3-262,http://dx.doi.org/10.5771/0943-7444-2011-3-262,,10.5771/0943-7444-2011-3-262,2893881590,,0,,8
002-733-369-145-420,Metadata Object Description Schema (MODS) in Digital Repositories: An Exploratory Study of Metadata Use and Quality,,2009,journal article,Knowledge Organization,09437444,International Society for Knowledge Organization,Germany,Jung-ran Park; Susan Maszaros,"Jung-ran Park is assistant professor at the College of Information Science and Technology, Drexel University. Prior to joining Drexel University, she worked as a cataloger at Indiana State University. She received a Ph.D. in linguistics and an MLIS from the University of Hawaii. She has applied her linguistics background to her primary research areas in knowledge organization and representation, computer-mediated communication and cross-lingual information access. Dr. Park is currently the principal investigator of a grant project ""Metadata Creation and Metadata Quality Control across Digital Collections: Evaluation of Current Practices"" from the Institute of Museum and Library Services.",36,1,46,59,World Wide Web; Information access; Assistant professor; Metadata Object Description Schema; Knowledge organization; Computer science; Exploratory research; XML; Metadata; Information science,,,,,http://cat.inist.fr/?aModele=afficheN&cpsidt=24455072 http://dx.doi.org/10.5771/0943-7444-2009-1-46,http://dx.doi.org/10.5771/0943-7444-2009-1-46,,10.5771/0943-7444-2009-1-46,2524262891,,0,,3
003-162-710-191-077,User Profiling on a Pilot Digital Library with the Final Result of a New Adaptive Knowledge Management Solution,,2011,journal article,Knowledge Organization,09437444,International Society for Knowledge Organization,Germany,Karl Petrič; Teodor Petrič; Marjan Krisper; Vladislav Rajkovič,"In this article, several procedures (e.g., measurements, information retrieval analyses, power law, association rules, hierarchical clustering) are introduced which were made on a pilot digital library. Information retrievals of web users from 01/01/2003 to 01/01/2006 on the internal search engine of the pilot digital library have been analyzed. With the power law method of data processing, a constant information retrieval pattern has been established, stable over a longer period of time. After this, the data have been analyzed. On the basis of the accomplished measurements and analyses, a series of mental models of web users for global (educational) purposes have been developed (e.g., the metamodel of thought hierarchy of web users, the segmentation model of web users), and the users were profiled in four different groups (adventurers, observers, applicable, and know-alls). The article concludes with the construction of a new knowledge management solution called multidimensional rank thesaurus.",38,2,96,113,Data mining; Data processing; Profiling (computer programming); Association rule learning; Information retrieval; Hierarchy; Computer science; Digital library; Knowledge management; Metamodeling; Segmentation; Hierarchical clustering,,,,,http://dx.doi.org/10.5771/0943-7444-2011-2-96 http://cat.inist.fr/?aModele=afficheN&cpsidt=24274261,http://dx.doi.org/10.5771/0943-7444-2011-2-96,,10.5771/0943-7444-2011-2-96,2526410924,,0,035-753-073-379-418; 090-885-354-392-642; 101-021-300-225-610; 105-614-742-799-485; 106-469-865-732-588; 115-918-357-438-638; 186-280-256-567-292,3
003-608-201-421-94X,"Keywords, Indexing, Text Analysis: An Editorial",,2013,journal article,Knowledge Organization,09437444,International Society for Knowledge Organization,Germany,Richard P. Smiraglia,,40,3,155,159,Information retrieval; Computer science; Text mining; Search engine indexing,,,,,http://dx.doi.org/10.5771/0943-7444-2013-3-155,http://dx.doi.org/10.5771/0943-7444-2013-3-155,,10.5771/0943-7444-2013-3-155,2811157458,,0,,1
003-635-763-775-698,Dynamic Subject Numbers Replace Traditional Classification Numbers,,2013,journal article,Knowledge Organization,09437444,International Society for Knowledge Organization,Germany,Kuan-nien Chen,,40,3,160,168,Computer science; Arithmetic,,,,,http://dx.doi.org/10.5771/0943-7444-2013-3-160,http://dx.doi.org/10.5771/0943-7444-2013-3-160,,10.5771/0943-7444-2013-3-160,2810267648,,0,,1
003-766-466-266-010,"Specifying Intersystem Relations: Requirements, Strategies, and Issues",,2010,journal article,Knowledge Organization,09437444,International Society for Knowledge Organization,Germany,Felix Boteram; Jessica Hubrich,,37,3,216,222,Risk analysis (engineering); Computer science,,,,,http://dx.doi.org/10.5771/0943-7444-2010-3-216,http://dx.doi.org/10.5771/0943-7444-2010-3-216,,10.5771/0943-7444-2010-3-216,2893591452,,0,,2
004-734-767-878-31X,Knowledge Organization Through Statistical Computation: A New Approach,,2009,journal article,Knowledge Organization,09437444,International Society for Knowledge Organization,Germany,Yang Xu; Alain Bernard,,36,4,227,239,Data science; Knowledge organization; Statistical computation; Computer science,,,,,https://hal.archives-ouvertes.fr/hal-00466273,http://dx.doi.org/10.5771/0943-7444-2009-4-227,,10.5771/0943-7444-2009-4-227,2735499032,,0,,10
004-773-263-785-613,Clare Beghtol: Exploring New Approaches to the Organization of Knowledge,,2010,journal article,Knowledge Organization,09437444,International Society for Knowledge Organization,Germany,Lynne C. Howarth,,37,2,95,100,Sociology; Knowledge management,,,,,http://dx.doi.org/10.5771/0943-7444-2010-2-95,http://dx.doi.org/10.5771/0943-7444-2010-2-95,,10.5771/0943-7444-2010-2-95,2894227162,,0,,1
005-151-797-809-210,Tensions Between Language and Discourse in North American Knowledge Organization,2011-11-04,2011,journal article,Knowledge Organization,09437444,International Society for Knowledge Organization,Germany,D. Grant Campbell,,2,1,10,16,Organizational learning; Political science; Information system; Knowledge organization; Engineering ethics; Knowledge management,,,,,http://journals.lib.washington.edu/index.php/nasko/article/download/12808/11290 https://journals.lib.washington.edu/index.php/nasko/article/view/12808/11290 http://arizona.openrepository.com/arizona/handle/10150/105546,http://dx.doi.org/10.7152/nasko.v2i1.12808,,10.7152/nasko.v2i1.12808,2041423056,,0,001-464-919-938-400; 009-893-668-495-073; 022-564-361-964-481; 025-695-726-174-626; 029-275-535-129-990; 067-568-080-743-552; 078-173-134-669-320; 093-342-291-216-462; 107-960-658-213-343; 130-225-649-609-20X; 153-202-738-358-898; 159-238-666-172-324; 161-752-846-263-489; 174-812-603-865-761; 182-864-646-837-95X; 191-828-965-218-564; 193-627-707-985-201,2
005-477-590-821-001,A Practical Application of FRBR for Organizing Information in Digital Environments,,2012,journal article,Knowledge Organization,09437444,International Society for Knowledge Organization,Germany,Yunseon Choi,"This study employs the FRBR (Functional Requirements for Bibliographic Records) conceptual model to provide in-depth investigation on the characteristics of social tags by analyzing the bibliographic attributes of tags that are not limited to subject properties. FRBR describes four different levels of entities (i.e., Work, Expression, Manifestation, and Item), which provide a distinguishing understanding of each entity in the bibliographic universe. In this research, since the scope of data analysis focuses on tags assigned to web documents, consideration on Manifestation and Item has been excluded. Accordingly, only the attributes of Work and Expression entity were investigated in order to map the attributes of tags to attributes defined in those entities. The content analysis on tag attributes was conducted on a total of 113 web documents regarding 11 attribute categories defined by FRBR. The findings identified essential bibliographic attributes of tags and tagging behaviors by subject. The findings showed that concerning specific subject areas, taggers exhibited different tagging behaviors representing distinctive features and tendencies. These results have led to the conclusion that there should be an increased awareness of diverse user needs by subject in terms of the practical implications of metadata generation.",39,4,233,254,Entity–relationship model; Conceptual model; World Wide Web; Content analysis; Information retrieval; Cataloging; Functional Requirements for Bibliographic Records; Social tags; Subject areas; Computer science; Metadata,,,,,http://dx.doi.org/10.5771/0943-7444-2012-4-233 http://cat.inist.fr/?aModele=afficheN&cpsidt=26220881,http://dx.doi.org/10.5771/0943-7444-2012-4-233,,10.5771/0943-7444-2012-4-233,2468024838,,0,,3
006-525-494-124-249,Visual Analysis of Classification Scheme,,2010,journal article,Knowledge Organization,09437444,International Society for Knowledge Organization,Germany,Veslava Osińska,,37,4,299,306,Classification scheme; Artificial intelligence; Pattern recognition; Computer science,,,,,http://dx.doi.org/10.5771/0943-7444-2010-4-299,http://dx.doi.org/10.5771/0943-7444-2010-4-299,,10.5771/0943-7444-2010-4-299,2894187295,,0,,3
007-622-828-791-502,Rhizomes in the iField: What Does it Mean to be an iSchool?,,2013,journal article,Knowledge Organization,09437444,International Society for Knowledge Organization,Germany,Kathleen Burnett; Laurie J. Bonnici,,40,6,408,413,Rhizome; Computer science,,,,,http://dx.doi.org/10.5771/0943-7444-2013-6-408,http://dx.doi.org/10.5771/0943-7444-2013-6-408,,10.5771/0943-7444-2013-6-408,2810967290,,0,,3
008-909-769-208-35X,,,2012,journal issue,KNOWLEDGE ORGANIZATION,09437444,Nomos Verlag,,,,39,6,,,,,,,,,http://dx.doi.org/10.5771/0943-7444-2012-6,,10.5771/0943-7444-2012-6,,,0,,0
009-469-524-971-648,ISKO 12’s Bookshelf—Evolving Intension: An Editorial,,2013,journal article,Knowledge Organization,09437444,International Society for Knowledge Organization,Germany,Richard P. Smiraglia,,40,1,3,10,Library science; Computer science; Intension,,,,,http://dx.doi.org/10.5771/0943-7444-2013-1-3,http://dx.doi.org/10.5771/0943-7444-2013-1-3,,10.5771/0943-7444-2013-1-3,2810613342,,0,,2
009-477-517-486-695,Knowledge Creation and Commercialization Activities in Polish Public HEUs in the Area of Technical and Engineering Sciences,,2013,journal article,Knowledge Organization,09437444,International Society for Knowledge Organization,Germany,Urszula Sienkiewicz; Izabela Kijeńska-Dąbrowska,,40,2,136,146,Engineering; Commercialization; Knowledge creation; Knowledge management,,,,,http://dx.doi.org/10.5771/0943-7444-2013-2-136,http://dx.doi.org/10.5771/0943-7444-2013-2-136,,10.5771/0943-7444-2013-2-136,2809787990,,0,,1
011-224-757-086-670,A Note from the Editor,,2009,journal article,KNOWLEDGE ORGANIZATION,09437444,Nomos Verlag,,,,36,4,263,263,,,,,,,http://dx.doi.org/10.5771/0943-7444-2009-4-263,,10.5771/0943-7444-2009-4-263,,,0,,0
011-818-316-829-385,Signposting the Crossroads: Terminology Web Services and Classification-Based Interoperability,,2010,journal article,Knowledge Organization,09437444,International Society for Knowledge Organization,Germany,Gordon Dunsire; Dennis Nicholson,,37,4,280,286,World Wide Web; Interoperability; Web service; Computer science; Terminology,,,,,http://dx.doi.org/10.5771/0943-7444-2010-4-280,http://dx.doi.org/10.5771/0943-7444-2010-4-280,,10.5771/0943-7444-2010-4-280,2893443513,,0,,2
012-652-438-359-587,"Tabulating Queer: Space, Perversion, and Belonging",,2009,journal article,Knowledge Organization,09437444,International Society for Knowledge Organization,Germany,Patrick Keilty,"Considering fields as diverse as the history of science, Internet studies, border studies, and coalition politics, the article gives an historical overview of how the knowledge around queer phe- nomena has been structured, tabulated, and spacialized: the hazards, coercive and productive qualities, as well as queer's para- doxical relationship as both resistant to and reliant on categories, classification, and knowledge structures. In the process, the article also considers the development of Western hierarchical knowledge structures in relation to societal power dynamics, proximity, and space.",36,4,240,248,Epistemology; Sociology; Internet studies; Queer; Perversion; Power dynamics; Social science; History of science; Politics; New media,,,,,https://tspace.library.utoronto.ca/bitstream/1807/78144/1/ko3620094f.pdf https://tspace.library.utoronto.ca/handle/1807/78144,http://dx.doi.org/10.5771/0943-7444-2009-4-240,,10.5771/0943-7444-2009-4-240,2164334023,,0,021-552-143-004-04X; 044-094-604-229-17X; 050-941-211-008-167; 059-438-671-773-803; 069-834-973-809-573; 079-765-735-090-280; 093-342-291-216-462; 100-079-513-299-504; 108-738-808-504-234; 132-412-668-018-006; 148-571-180-308-199,16
012-718-135-350-429,Index to Volume 39,,2013,journal article,KNOWLEDGE ORGANIZATION,09437444,Nomos Verlag,,,,40,1,79,80,,,,,,,http://dx.doi.org/10.5771/0943-7444-2013-1-79,,10.5771/0943-7444-2013-1-79,,,0,,0
013-831-568-355-859,A Pragmatic Semeiotic Perspective on the Concept of Information Need and Its Relevance for Knowledge Organization,,2013,journal article,Knowledge Organization,09437444,International Society for Knowledge Organization,Germany,Martin Thellefsen; Torkild Thellefsen; Brent Sørenson,,40,4,213,224,Knowledge organization; Computer science; Knowledge management; Information needs,,,,,http://dx.doi.org/10.5771/0943-7444-2013-4-213,http://dx.doi.org/10.5771/0943-7444-2013-4-213,,10.5771/0943-7444-2013-4-213,2810805035,,0,004-039-225-663-416; 005-599-457-386-376; 009-248-538-955-105; 028-138-506-770-052; 033-230-410-350-988; 035-263-247-754-424; 035-789-193-786-274; 046-372-661-221-879; 046-543-449-102-534; 048-807-509-929-939; 050-001-631-698-723; 053-409-937-285-225; 058-422-233-534-682; 064-979-192-032-082; 065-006-768-164-017; 066-482-498-803-037; 081-335-225-857-914; 087-831-676-456-440; 097-051-534-903-351; 113-243-207-500-226; 115-864-616-763-910; 119-763-046-270-841; 122-834-688-224-453; 123-476-910-300-357; 128-176-217-173-051; 167-219-482-137-774; 180-718-985-578-94X; 193-989-829-527-055; 194-391-518-246-985; 195-814-701-071-640,3
014-557-729-820-211,Spanish Research in Knowledge Organization (2002-2010),,2013,journal article,Knowledge Organization,09437444,International Society for Knowledge Organization,Germany,Mercedes de la Moneda Corrochano; María J. López-Huertas; Evaristo Jiménez Contreras,,40,1,28,41,Sociology; Knowledge organization; Knowledge management,,,,,http://dx.doi.org/10.5771/0943-7444-2013-1-28,http://dx.doi.org/10.5771/0943-7444-2013-1-28,,10.5771/0943-7444-2013-1-28,2915295577,,0,,2
014-837-246-679-053,"Introduction to the Special Issue: ‘Paradigms of Knowledge and its Organization: The Tree, the Net and Beyond’",,2013,journal article,Knowledge Organization,09437444,International Society for Knowledge Organization,Germany,Fulvio Mazzocchi; Gian Carlo Fedeli,,40,6,363,365,The Internet; Computer science; Knowledge management,,,,,http://dx.doi.org/10.5771/0943-7444-2013-6-363,http://dx.doi.org/10.5771/0943-7444-2013-6-363,,10.5771/0943-7444-2013-6-363,2809899417,,0,,4
014-940-432-329-028,URT “Indexing and Classification Systems” Projects and Biomedical Knowledge Standards,,2012,journal article,Knowledge Organization,09437444,International Society for Knowledge Organization,Germany,Maria Teresa Chiaravalloti; Erika Pasceri; Maria Taverniti,,39,1,3,12,Data science; Biomedical knowledge; Computer science; Search engine indexing,,,,,http://dx.doi.org/10.5771/0943-7444-2012-1-3,http://dx.doi.org/10.5771/0943-7444-2012-1-3,,10.5771/0943-7444-2012-1-3,2809855124,,0,,0
015-255-393-824-253,ISKO 11’s Diverse Bookshelf: An Editorial,,2011,journal article,Knowledge Organization,09437444,International Society for Knowledge Organization,Germany,Richard P. Smiraglia,,38,3,179,186,Library science; Computer science,,,,,http://dx.doi.org/10.5771/0943-7444-2011-3-179,http://dx.doi.org/10.5771/0943-7444-2011-3-179,,10.5771/0943-7444-2011-3-179,2893905448,,0,,5
016-086-842-537-260,"Nonknowledge: The Bibliographical Organization of Ignorance, Stupidity, Error, and Unreason: Part Two",,2009,journal article,KNOWLEDGE ORGANIZATION,09437444,Nomos Verlag,Germany,Jay H. Bernstein,,36,4,249,260,,,,,,,http://dx.doi.org/10.5771/0943-7444-2009-4-249,,10.5771/0943-7444-2009-4-249,,,0,,3
016-219-984-491-233,Contemplating Co-creator Rights in Archival Description,,2012,journal article,Knowledge Organization,09437444,International Society for Knowledge Organization,Germany,Anne J. Gilliland,,39,5,340,346,Political science; Art history,,,,,http://dx.doi.org/10.5771/0943-7444-2012-5-340,http://dx.doi.org/10.5771/0943-7444-2012-5-340,,10.5771/0943-7444-2012-5-340,2811172139,,0,,11
016-780-208-466-573,Three creative tensions in document interpretation theory set as evidence of the need for a descriptive informatics,,2009,journal article,Knowledge Organization,09437444,International Society for Knowledge Organization,Germany,Joseph T. Tennis,"Describes three tensions in the theoretical literature of indexing: chief sources of evidence indexing, process of indexing (rubrics and methods), and philosophical position of indexing scholarship. Following this exposition, we argue for a change in perspective in Knowledge Organization research. Using the difference between prescriptive and descriptive linguistics as a metaphor, we advocate for a shift to a more descriptive, rather than the customary prescriptive, approach to the theoretical and empirical study of indexing, and by extension Knowledge Organization.",36,4,190,199,Epistemology; Rubric; Empirical research; Philosophical theory; Linguistic description; Scholarship; Metaphor; Knowledge organization; Computer science; Search engine indexing,,,,,http://faculty.washington.edu/jtennis/Publications_files/Tennis2009KO32-4.pdf https://digital.lib.washington.edu:443/researchworks/handle/1773/37946,http://dx.doi.org/10.5771/0943-7444-2009-4-190,,10.5771/0943-7444-2009-4-190,2565122350,,0,001-464-919-938-400; 007-716-747-884-19X; 016-338-096-452-975; 018-426-685-841-728; 038-249-176-007-541; 042-970-670-993-63X; 060-142-663-052-283; 060-719-330-389-965; 064-979-192-032-082; 074-697-929-068-168; 095-068-472-945-078; 104-677-724-566-719; 119-763-046-270-841; 124-358-133-724-25X; 138-561-175-358-392; 142-503-089-740-746; 142-660-795-318-795; 191-260-642-331-483,2
017-369-200-797-809,"Challenges of Diversity, Consistency, and Globality in Indexing of Local Archeological Artifacts",,2013,journal article,Knowledge Organization,09437444,International Society for Knowledge Organization,Germany,Teija Oikarinen; Terttu Kortelainen,,40,2,123,135,Information retrieval; Globality; Computer science; Search engine indexing,,,,,http://dx.doi.org/10.5771/0943-7444-2013-2-123,http://dx.doi.org/10.5771/0943-7444-2013-2-123,,10.5771/0943-7444-2013-2-123,2810841533,,0,,5
018-695-689-651-185,Reflexions on Multidimensional Knowledge: Its Influence on the Foundation of Knowledge Organization,,2013,journal article,Knowledge Organization,09437444,International Society for Knowledge Organization,Germany,María J. López-Huertas,,40,6,400,407,Sociology; Knowledge organization; Knowledge management,,,,,http://dx.doi.org/10.5771/0943-7444-2013-6-400,http://dx.doi.org/10.5771/0943-7444-2013-6-400,,10.5771/0943-7444-2013-6-400,2810374580,,0,,7
018-757-555-841-937,Titelei/Inhaltsverzeichnis,,2010,journal article,KNOWLEDGE ORGANIZATION,09437444,Nomos Verlag,,,,37,3,I,II,,,,,,,http://dx.doi.org/10.5771/0943-7444-2010-3-i,,10.5771/0943-7444-2010-3-i,,,0,,0
019-459-368-288-17X,"From Disorder to Order: A Challenge for the Philosopher and the Librarian (Milan, Italy)",,2009,journal article,Knowledge Organization,09437444,International Society for Knowledge Organization,Germany,Laura Frigerio,,36,2-3,150,159,Philosophy; Classics,,,,,https://moh-it.pure.elsevier.com/en/publications/from-disorder-to-order-a-challenge-for-the-philosopher-and-the-li,http://dx.doi.org/10.5771/0943-7444-2009-2-3-150,,10.5771/0943-7444-2009-2-3-150,2626323001,,0,,0
