Lens ID,Title,Date Published,Publication Year,Publication Type,Source Title,ISSNs,Publisher,Source Country,Author/s,Abstract,Volume,Issue Number,Start Page,End Page,Fields of Study,Keywords,MeSH Terms,Chemicals,Funding,Source URLs,External URL,PMID,DOI,Microsoft Academic ID,PMCID,Patent Citation Count,References,Scholarly Citation Count
051-872-668-520-881,Concepts and Terms – ISKO’s Major Challenge,,2009,journal article,Knowledge Organization,09437444,International Society for Knowledge Organization,Germany,Ingetraut Dahlberg,,36,2-3,169,177,Epistemology; Computer science,,,,,http://dx.doi.org/10.5771/0943-7444-2009-2-3-169,http://dx.doi.org/10.5771/0943-7444-2009-2-3-169,,10.5771/0943-7444-2009-2-3-169,2893487071,,0,,5
052-562-002-405-521,Towards a Taxonomy of KOS: Dimensions for Classifying Knowledge Organization Systems,,2012,journal article,Knowledge Organization,09437444,International Society for Knowledge Organization,Germany,Renato Rocha Souza; Douglas Tudhope; and Maurício Barcellos Almeida,,39,3,179,192,Knowledge organization; Computer science; Knowledge management; Taxonomy (biology),,,,,http://dx.doi.org/10.5771/0943-7444-2012-3-179,http://dx.doi.org/10.5771/0943-7444-2012-3-179,,10.5771/0943-7444-2012-3-179,2810708883,,0,,12
053-567-554-802-946,Impressum,,2011,journal article,KNOWLEDGE ORGANIZATION,09437444,Nomos Verlag,,,,38,2,174,175,,,,,,,http://dx.doi.org/10.5771/0943-7444-2011-2-174,,10.5771/0943-7444-2011-2-174,,,0,,0
053-882-971-560-917,What is the Nature of the Periodic Table as a Classification System,,2011,journal article,Knowledge Organization,09437444,,,Birger Hjørland; Eric Scerri; John Dupre,,38,1,,,Periodic table; Artificial intelligence; Knowledge organization; Computer science; Information processing,,,,,,,,,2472258177,,0,,0
054-102-156-969-675,"Martha Lampland and Susan Leigh Star, editors. Standards and Their Stories: How Quantifying, Classifying, and Formalizing Practices Shape Everyday Life. Ithaca, N.Y.: Cornell Univ. Pr., 2009. 280 p. ISBN 978-0-80144-717-4",,2010,journal article,KNOWLEDGE ORGANIZATION,09437444,Nomos Verlag,,,,37,1,79,82,,,,,,,http://dx.doi.org/10.5771/0943-7444-2010-1-79,,10.5771/0943-7444-2010-1-79,,,0,,0
054-539-386-177-296,Tension Between Language and Discourse in North American Knowledge Organization,,2010,journal article,KNOWLEDGE ORGANIZATION,09437444,Nomos Verlag,,D. Grant Campbell,,37,1,51,57,,,,,,,http://dx.doi.org/10.5771/0943-7444-2010-1-51,,10.5771/0943-7444-2010-1-51,,,0,,0
056-534-179-885-089,A Study Of Authority Control in Spanish University Repositories,,2012,journal article,Knowledge Organization,09437444,International Society for Knowledge Organization,Germany,Leticia Barrionuevo Almuzara; Mª Luisa Alvite Díez; and Blanca Rodríguez Bravo,,39,2,95,103,Political science; Authority control; Public administration,,,,,http://dx.doi.org/10.5771/0943-7444-2012-2-95-1,http://dx.doi.org/10.5771/0943-7444-2012-2-95-1,,10.5771/0943-7444-2012-2-95-1,2810119368,,0,,4
056-785-184-060-790,Titelei/Inhaltsverzeichnis,,2009,journal article,KNOWLEDGE ORGANIZATION,09437444,Nomos Verlag,,,,36,1,I,II,,,,,,,http://dx.doi.org/10.5771/0943-7444-2009-1-i,,10.5771/0943-7444-2009-1-i,,,0,,0
056-950-902-277-094,"Tagging of Biomedical Articles on CiteULike: A Comparison of User, Author and Professional Indexing",,2011,journal article,Knowledge Organization,09437444,International Society for Knowledge Organization,Germany,Margaret E. I. Kipp,"This paper examines the context of online indexing from the viewpoint of three different groups: users, authors, and professional indexers. User tags, author keywords and descriptors were collected from academic journal articles, which were both indexed in Pubmed and tagged on CiteULike, and analysed. Descriptive statistics, informetric measures, and thesaural term comparison shows that there are important differences in the use of keywords between the three groups in addition to similarities which can be used to enhance support for search and browse. While tags and author keywords were found that matched descriptors exactly, other terms which did not match but provided important expansion to the indexing lexicon were found. These additional terms could be used to enhance support for searching and browsing in article databases as well as to provide invaluable data for entry vocabulary and emergent terminology for regular updates to indexing systems. Additionally, the study suggests that tags support organisation by association to task, projects and subject while making important connections to traditional systems which classify into subject categories.",38,3,245,261,Information retrieval; Vocabulary; Lexicon; Descriptive statistics; Computer science; Terminology; Search engine indexing,,,,,http://eprints.rclis.org/15227/ http://eprints.rclis.org/15227/1/kipp-2011-biomedicaltagging-kovol38.pdf,http://dx.doi.org/10.5771/0943-7444-2011-3-245,,10.5771/0943-7444-2011-3-245,1590506303,,0,002-852-458-537-866; 005-255-725-462-840; 006-061-426-560-599; 009-893-668-495-073; 011-981-882-161-607; 023-896-010-128-294; 036-706-153-054-917; 056-691-156-113-309; 063-174-909-674-61X; 066-915-178-556-066; 067-080-082-794-709; 067-865-739-836-871; 078-854-735-841-644; 080-249-519-797-470; 088-125-089-430-818; 088-478-983-368-784; 114-758-821-565-205; 124-055-238-548-83X; 132-384-476-148-433; 135-120-936-631-160; 152-613-117-717-093; 168-238-772-948-559; 168-466-197-336-584; 179-818-820-671-33X; 181-329-720-583-409; 182-872-147-730-736; 196-666-483-027-24X; 197-613-177-416-551,18
057-482-953-015-774,Formal Ontology and the Foundation of Knowledge Organization,,2013,journal article,Knowledge Organization,09437444,International Society for Knowledge Organization,Germany,Heinrich Herre,,40,5,332,339,Formal ontology; Knowledge organization; Computer science; Knowledge management,,,,,http://dx.doi.org/10.5771/0943-7444-2013-5-332,http://dx.doi.org/10.5771/0943-7444-2013-5-332,,10.5771/0943-7444-2013-5-332,2811202454,,0,,6
057-693-373-488-727,Faceted navigation and browsing features in new OPACs: A more robust solution to problems of information seekers?,2011-11-04,2011,journal article,Knowledge Organization,09437444,International Society for Knowledge Organization,Germany,Kathryn La Barre,,1,1,63,74,World Wide Web; Seekers; Computer science; Multimedia,,,,,https://journals.lib.washington.edu/index.php/nasko/article/view/12835/11316 http://journals.lib.washington.edu/index.php/nasko/article/download/12835/11316,http://dx.doi.org/10.7152/nasko.v1i1.12835,,10.7152/nasko.v1i1.12835,2013504609,,0,015-329-839-227-533; 035-088-195-648-72X; 038-946-313-592-550; 049-176-264-529-125; 062-045-811-764-863; 074-017-327-981-054; 097-082-429-956-664; 110-074-946-591-316; 130-284-396-569-325; 130-760-370-816-142; 142-045-270-653-852; 156-674-838-995-645; 181-320-609-292-59X; 189-474-484-148-107,3
058-201-431-727-742,"Knowledge organization for feminism and feminist research : a discourse oriented study of systematic outlines, logical structure, semantics and the process of indexing",2010-01-01,2010,journal article,Knowledge Organization,09437444,International Society for Knowledge Organization,Germany,Jenny Samuelsson,The focus in this article is directed towards an analysis of the knowledge organization systems that index and classify feminist research texts in a Swedish bibliographic context. The article also ...,37,1,3,28,Semantics; Sociology; Structure (mathematical logic); Feminism; Knowledge organization; Feminist research; Linguistics; Search engine indexing,,,,,http://www.diva-portal.org/smash/record.jsf?pid=diva2:989301 http://umu.diva-portal.org/smash/record.jsf?pid=diva2:299513,http://dx.doi.org/10.5771/0943-7444-2010-1-3,,10.5771/0943-7444-2010-1-3,160620719,,0,,5
058-368-905-888-121,Titelei/Inhaltsverzeichnis,,2010,journal article,KNOWLEDGE ORGANIZATION,09437444,Nomos Verlag,,,,37,4,I,II,,,,,,,http://dx.doi.org/10.5771/0943-7444-2010-4-i,,10.5771/0943-7444-2010-4-i,,,0,,0
058-752-549-110-597,Titelei/Inhaltsverzeichnis,,2013,journal article,KNOWLEDGE ORGANIZATION,09437444,Nomos Verlag,,,,40,4,211,212,,,,,,,http://dx.doi.org/10.5771/0943-7444-2013-4-211,,10.5771/0943-7444-2013-4-211,,,0,,0
059-611-580-408-33X,The Convergence of Metadata and Bibliographic Control? Trends and Patterns in Addressing the Current Issues and Challenges of Providing Subject Access,,2010,journal article,Knowledge Organization,09437444,International Society for Knowledge Organization,Germany,Jack Hang-Tat Leong,"Resource description and discovery have been facilitated generally in two approaches, namely bibliographic control and metadata, which now may converge in response to current issues and challenges of providing subject access. Four categories of major issues and challenges in the provision of subject access to digital and non-digital resources are: 1) the advancement of new knowledge; 2) the fall of controlled vocabulary and the rise of natural language; 3) digitizing and networking the traditional catalogue systems; and 4) electronic publishing and the Internet. The creation of new knowledge and the debate about the use of natural language and controlled vocabulary as subject headings becomes even more intense in the digital and online environment. The third and fourth categories are conceived after the emergence of networked environments and the rapid expansion of electronic resources. Recognizing the convergence of metadata schemas and bibliographic control calls for adapting to the new environment by developing tools that exploit the strengths of both.",37,1,29,42,Controlled vocabulary; The Internet; World Wide Web; Exploit; Electronic publishing; Natural language; Subject access; Knowledge organization; Computer science; Metadata,,,,,http://cat.inist.fr/?aModele=afficheN&cpsidt=24463508 http://dx.doi.org/10.5771/0943-7444-2010-1-29,http://dx.doi.org/10.5771/0943-7444-2010-1-29,,10.5771/0943-7444-2010-1-29,2463025451,,0,,3
060-372-899-346-10X,Multidimensional classifications: Past and future conceptualizations and visualizations,2011-11-02,2011,journal article,Knowledge Organization,09437444,International Society for Knowledge Organization,Germany,Charles van den Heuvel,"This paper maps the concepts “space” and “dimensionality” in classifications, in particular in visualizations hereof, from a historical perspective. After a historical excursion in the domain of classification theory of what in mathematics is known as dimensionality reduction in representations of a single universe of knowledge, its potentiality will be explored for information retrieval and navigation of the World Wide Web.",39,6,105,121,Curse of dimensionality; Data science; Excursion; Mathematics; Dimensionality reduction,,,,,https://core.ac.uk/display/85572448 http://journals.lib.washington.edu/index.php/nasko/article/download/12795/11287 https://journals.lib.washington.edu/index.php/nasko/article/view/12795/11287 https://www.narcis.nl/publication/RecordID/oai%3Apure.knaw.nl%3Apublications%2F88e07c90-31e4-4e19-b2d0-6a33cd7823cc,https://journals.lib.washington.edu/index.php/nasko/article/view/12795/11287,,,2037657562,,0,006-259-604-105-85X; 020-733-364-603-720; 020-940-046-820-940; 030-052-392-380-99X; 035-013-129-167-876; 038-249-176-007-541; 046-028-626-349-479; 060-451-766-710-516; 073-399-956-149-797; 080-945-058-659-719; 087-266-161-452-054; 163-021-556-113-857; 169-020-951-232-374,3
061-018-838-320-648,"Metadata About What? Distinguishing Between Ontic, Epistemic, and Documental Dimensions in Knowledge Organization",,2012,journal article,Knowledge Organization,09437444,International Society for Knowledge Organization,Germany,Claudio Gnoli,"Claudio Gnoli has been working as an academic librarian since 1994. His main interest is classification theory. He has published papers on this subject in several international journals and conference pro- ceedings. He is a member of the scientific advisory boards of the Universal Decimal Classification Con- sortium (UDCC) and of the journal Knowledge Organization, and vice-president of the International Society for Knowledge Organization (ISKO). Gnoli, Claudio. Metadata About What? Distinguishing Between Ontic, Epistemic, and Documental Dimensions in Knowledge Organization. Knowledge Organization. 39(4), 268-275. 37 references. ABSTRACT: The spread of many new media and formats is changing the scenario faced by knowledge organizers: as printed monographs are not the only standard form of knowledge carrier anymore, the traditional kind of knowl- edge organization (KO) systems based on academic disciplines is put into question. A sounder foundation can be provided by an analysis of the different dimensions concurring to form the content of any knowledge item—what Brian Vickery described as the steps ""from the world to the classifier."" The ultimate referents of documents are the phenomena of the real world, that can be ordered by ontology, the study of what exists. Phenomena coexist in subjects with the perspectives by which they are considered, pertaining to epistemology, and with the formal features of knowledge carriers, adding a further, pragmatic layer. All these di- mensions can be accounted for in metadata, but are often done so in mixed ways, making indexes less rigorous and interoperable. For example, while facet analysis was originally developed for subject indexing, many ""faceted"" interfaces today mix subject fac- ets with form facets, and schemes presented as ""ontologies"" for the ""semantic Web"" also code for non-semantic information. In bibliographic classifications, phenomena are often confused with the disciplines dealing with them, the latter being assumed to be the most useful starting point, for users will have either one or another perspective. A general citation order of dimensions— phenomena, perspective, carrier—is recommended, helping to concentrate most relevant information at the beginning of head- ings.",39,4,268,275,Epistemology; Ontology (information science); Body of knowledge; Universal Decimal Classification; Ontology; Ontic; Subject indexing; Knowledge organization; Computer science; Metadata,,,,,http://www-dimat.unipv.it/~gnoli/gnoli2012.pdf,http://dx.doi.org/10.5771/0943-7444-2012-4-268,,10.5771/0943-7444-2012-4-268,2182084268,,0,008-283-550-062-243; 009-859-469-551-600; 010-837-954-398-185; 027-396-266-532-738; 029-696-149-461-94X; 038-249-176-007-541; 046-308-014-520-294; 048-841-863-051-646; 050-346-539-439-36X; 051-411-953-914-482; 052-694-680-995-326; 058-186-376-711-541; 068-112-917-094-066; 071-893-988-303-26X; 072-020-365-696-056; 087-831-676-456-440; 093-118-965-830-64X; 093-342-291-216-462; 098-314-043-447-003; 098-507-725-113-618; 098-981-178-271-366; 110-269-455-474-000; 129-202-026-489-574; 131-047-646-757-490; 133-637-302-325-670; 142-255-262-450-284; 148-143-435-462-315; 149-587-753-798-301; 153-017-318-509-51X; 156-598-760-048-637; 168-032-210-550-596,8
061-551-080-874-924,,,2012,journal issue,KNOWLEDGE ORGANIZATION,09437444,Nomos Verlag,,,,39,2,,,,,,,,,http://dx.doi.org/10.5771/0943-7444-2012-2,,10.5771/0943-7444-2012-2,,,0,,0
062-086-201-884-316,Is FRBR a Domain? Domain Analysis Applied to the Literature of The FRBR Family of Conceptual Models,2013-10-31,2013,journal article,Knowledge Organization,09437444,International Society for Knowledge Organization,Germany,Richard P. Smiraglia,"Domain analysis helps visualize the semantic intellectual content of a coherent group, or domain. A domain is a group with an ontological base, an underlying teleology, common hypotheses and epistemology, and social semantics. FRBR has spawned a family of conceptual models, and much writing. A recent second anthology about the FRBR models raises the question of whether a coherent domain has formed around the FRBR family. Domain analysis is used here to visualize the semantic content of the FRBR family domain, and to compare its two main component groups, scholar authors and practitioner authors. Results show a common teleology with some subtle differences surrounding implementation of the FRBR family of models.",4,1,174,185,Conceptual model; Artificial intelligence; Domain analysis; Cognitive science; Ontology; Social semantics; Intellectual content; A domain; Mathematics; Teleology,,,,,http://journals.lib.washington.edu/index.php/nasko/article/download/14658/12301 http://journals.lib.washington.edu/index.php/nasko/article/view/14658,http://dx.doi.org/10.7152/nasko.v4i1.14658,,10.7152/nasko.v4i1.14658,2076048144,,0,007-488-766-021-822; 013-993-917-540-609; 102-347-100-976-096; 176-375-254-109-852; 190-614-225-751-822,1
062-505-093-895-096,"Classifying Philosophy at the Library of the Scuola Normale Superiore (Pisa, Italy), Part A",,2009,journal article,Knowledge Organization,09437444,International Society for Knowledge Organization,Germany,Raffaele Giampietro,,36,2-3,141,145,Sociology; Humanities,,,,,http://dx.doi.org/10.5771/0943-7444-2009-2-3-141,http://dx.doi.org/10.5771/0943-7444-2009-2-3-141,,10.5771/0943-7444-2009-2-3-141,2892892286,,0,,0
062-506-395-882-340,Classical Pragmatism and its Varieties: On a Pluriform Metatheoretical Perspective for Knowledge Organization,,2010,journal article,KNOWLEDGE ORGANIZATION,09437444,Nomos Verlag,,Thomas M. Dousa,,37,1,65,71,,,,,,,http://dx.doi.org/10.5771/0943-7444-2010-1-65,,10.5771/0943-7444-2010-1-65,,,0,,2
062-833-134-302-043,Disciplining Knowledge at the Library of Congress,,2012,journal article,Knowledge Organization,09437444,International Society for Knowledge Organization,Germany,Melissa Adler,,39,5,370,376,Library science; Political science; Library of congress,,,,,http://dx.doi.org/10.5771/0943-7444-2012-5-370,http://dx.doi.org/10.5771/0943-7444-2012-5-370,,10.5771/0943-7444-2012-5-370,2810988590,,0,,5
065-085-663-148-457,Titelei/Inhaltsverzeichnis,,2011,journal article,KNOWLEDGE ORGANIZATION,09437444,Nomos Verlag,,,,38,2,I,II,,,,,,,http://dx.doi.org/10.5771/0943-7444-2011-2-i,,10.5771/0943-7444-2011-2-i,,,0,,0
067-195-084-305-016,Network Theory and Terminology.,,2013,journal article,Knowledge Organization,09437444,International Society for Knowledge Organization,Germany,Ágota Fóris,"The paper aims to present the relations of network theory and terminology. The model of scale-free networks, which has been recently developed and widely applied since, can be effectively used in terminology research as well. Operation based on the principle of networks is a universal characteristic of complex systems. Networks are governed by general laws. The model of scale-free networks can be viewed as a statistical-probability model, and it can be described with mathematical tools. Its main feature is that ‘everything is connected to everything else’, that is every node is reachable (in a few steps) starting from any other node; this phenomena called ‘the small world phenomenon’. The existence of a linguistic network and the general laws of the operation of networks enable us to place issues of language use in the complex system of relations that reveal the deeper connections between phenomena with the help of networks embedded in each other. The realization of the metaphor that language also has a network structure is the basis of the classification methods of the terminological system, and likewise of the ways of creating terminology databases, which serve the purpose of providing easy and versatile accessibility to specialised knowledge.",40,6,422,431,Network theory; Artificial intelligence; Metaphor; Network structure; Classification methods; Computer science; Complex system; Phenomenon; Terminology,,,,,http://real.mtak.hu/27031/,http://dx.doi.org/10.5771/0943-7444-2013-6-422,,10.5771/0943-7444-2013-6-422,1682641436,,0,,2
067-607-380-390-014,"The Structure of Knowledge: Classifications of Science and Learning since the Renaissance, edited by Tore Frängsmyr",,2012,journal article,KNOWLEDGE ORGANIZATION,09437444,Nomos Verlag,,,,39,2,137,141,,,,,,,http://dx.doi.org/10.5771/0943-7444-2012-2-137,,10.5771/0943-7444-2012-2-137,,,0,,0
067-682-917-864-735,Abridged Dewey-15 (2012) in Historical Perspectives,,2012,journal article,Knowledge Organization,09437444,International Society for Knowledge Organization,Germany,Mohindar Partap Satija,,39,6,466,470,Computer science; Classics,,,,,http://dx.doi.org/10.5771/0943-7444-2012-6-466,http://dx.doi.org/10.5771/0943-7444-2012-6-466,,10.5771/0943-7444-2012-6-466,2810726435,,0,,3
068-142-291-971-027,Proposal for a Classification of Classifications built on Beghtol’s Distinction between “Naïve Classification” and “Professional Classification”,,2010,journal article,Knowledge Organization,09437444,International Society for Knowledge Organization,Germany,Elin K. Jacob,,37,2,111,120,Artificial intelligence; Natural language processing; Computer science,,,,,http://dx.doi.org/10.5771/0943-7444-2010-2-111,http://dx.doi.org/10.5771/0943-7444-2010-2-111,,10.5771/0943-7444-2010-2-111,2893688993,,0,,4
068-299-337-470-523,The Catalog Resisting the Web: An Historical Perspective,,2012,journal article,Knowledge Organization,09437444,International Society for Knowledge Organization,Germany,Philippe Bourdenet,,39,4,276,282,World Wide Web; History,,,,,http://dx.doi.org/10.5771/0943-7444-2012-4-276,http://dx.doi.org/10.5771/0943-7444-2012-4-276,,10.5771/0943-7444-2012-4-276,2809923621,,0,,0
068-632-795-597-624,,,2013,journal issue,KNOWLEDGE ORGANIZATION,09437444,Nomos Verlag,,,,40,4,,,,,,,,,http://dx.doi.org/10.5771/0943-7444-2013-4,,10.5771/0943-7444-2013-4,,,0,,0
072-289-107-780-687,Analysis of Knowledge Organization Systems as Complex Systems: A New Approach to Deal With Changes in the Web,,2012,journal article,Knowledge Organization,09437444,International Society for Knowledge Organization,Germany,María G. Bonome,,39,2,104,110,Knowledge organization; Computer science; Complex system; Knowledge management,,,,,http://dx.doi.org/10.5771/0943-7444-2012-2-104,http://dx.doi.org/10.5771/0943-7444-2012-2-104,,10.5771/0943-7444-2012-2-104,2811441112,,0,,1
072-378-720-858-790,"Szostak, Rick. 2003. A Schema for Unifying Human Science: Interdisciplinary Perspectives on Culture. Selinsgrove, PA: Susquehanna UP",,2012,journal article,KNOWLEDGE ORGANIZATION,09437444,Nomos Verlag,,,,39,4,300,300,,,,,,,http://dx.doi.org/10.5771/0943-7444-2012-4-300,,10.5771/0943-7444-2012-4-300,,,0,,0
073-214-186-812-623,Classification Issues in 2007,,2009,journal article,Knowledge Organization,09437444,International Society for Knowledge Organization,Germany,Nancy J. Williamson,,36,1,66,74,Data science; Computer science,,,,,http://dx.doi.org/10.5771/0943-7444-2009-1-66,http://dx.doi.org/10.5771/0943-7444-2009-1-66,,10.5771/0943-7444-2009-1-66,2892783720,,0,,0
073-232-369-718-84X,Information Sciences Methodological Aspects Applied to Ontology Reuse Tools: A Study Based on Genomic Annotations in the Domain of Trypanosomatides,,2013,journal article,Knowledge Organization,09437444,International Society for Knowledge Organization,Germany,Maria Luiza de Almeida Campos; Maria Luiza Machado Campos; Alberto M. R. Dávila; Hagar Espanha Gomes; Linair Maria Campos; and Laura de Lira e Oliveira,,40,1,50,61,Information retrieval; Ontology reuse; Computer science; Information science,,,,,http://dx.doi.org/10.5771/0943-7444-2013-1-50,http://dx.doi.org/10.5771/0943-7444-2013-1-50,,10.5771/0943-7444-2013-1-50,2810731122,,0,,1
073-383-734-935-016,,,2013,journal issue,KNOWLEDGE ORGANIZATION,09437444,Nomos Verlag,,,,40,6,,,,,,,,,http://dx.doi.org/10.5771/0943-7444-2013-6,,10.5771/0943-7444-2013-6,,,0,,0
074-239-248-132-365,"Indexing Historical, Political Cartoons for Retrieval",,2013,journal article,Knowledge Organization,09437444,International Society for Knowledge Organization,Germany,Yejun Wu,,40,5,283,294,Computer science; Linguistics; Search engine indexing; Politics,,,,,http://dx.doi.org/10.5771/0943-7444-2013-5-283,http://dx.doi.org/10.5771/0943-7444-2013-5-283,,10.5771/0943-7444-2013-5-283,2809881327,,0,,4
075-322-252-829-361,,,2010,journal issue,KNOWLEDGE ORGANIZATION,09437444,Nomos Verlag,,,,37,3,,,,,,,,,http://dx.doi.org/10.5771/0943-7444-2010-3,,10.5771/0943-7444-2010-3,,,0,,0
076-440-922-902-702,A Method for Developing a Domain Ontology: A Case Study for a Multidisciplinary Subject,,2010,journal article,Knowledge Organization,09437444,International Society for Knowledge Organization,Germany,Sangeeta Deokattey; Arashanipalai Neelameghan; Vijai Kumar,,37,3,173,184,Software engineering; Multidisciplinary approach; Ontology; A domain; Computer science,,,,,http://dx.doi.org/10.5771/0943-7444-2010-3-173,http://dx.doi.org/10.5771/0943-7444-2010-3-173,,10.5771/0943-7444-2010-3-173,2894457096,,0,,7
076-722-422-348-843,Titelei/Inhaltsverzeichnis,,2011,journal article,KNOWLEDGE ORGANIZATION,09437444,Nomos Verlag,,,,38,3,I,II,,,,,,,http://dx.doi.org/10.5771/0943-7444-2011-3-i,,10.5771/0943-7444-2011-3-i,,,0,,0
078-407-408-005-804,,,2012,journal issue,KNOWLEDGE ORGANIZATION,09437444,Nomos Verlag,,,,39,4,,,,,,,,,http://dx.doi.org/10.5771/0943-7444-2012-4,,10.5771/0943-7444-2012-4,,,0,,0
078-486-815-017-886,Sexual Boundaries and Subcultural Discipline,,2012,journal article,KNOWLEDGE ORGANIZATION,09437444,Nomos Verlag,Germany,Patrick Keilty,,39,6,417,431,,,,,,,http://dx.doi.org/10.5771/0943-7444-2012-6-417,,10.5771/0943-7444-2012-6-417,,,0,,3
