,new_index,Lens ID_Train,index,Abstract_Train,Abstract_trim_2_Train,Lens ID_Test,Abstract_Test,Abstract_trim_2_Test,Dickson,Andy,Bill
51,51hello,194-391-518-246-985,51,"This article is organized in 10 sections: (1) Knowledge Organization (KO) is a wide interdisciplinary field, much broader than Library and Information Science (LIS). (2) Inside LIS there have been many different approaches and traditions of KO with little mutual influence. These traditions have to a large extent been defined by new technology, for which reason the theoretical integration and underpinning has not been well considered. The most important technology-driven traditions are: a) Manual indexing and classification in libraries and reference works, b) Documentation and scientific communication, c) Information storage and retrieval by computers, d) Citation based KO and e) Full text, hypertext and Internet based approaches. These traditions taken together define very much the special LIS focus on KO. For KO as a field of research it is important to establish a fruitful theoretical frame of reference for this overall field. This paper provides some suggestions. (3) One important, theoretical distinction to consider is the one between social and intellectual forms of KO. Social forms of KO are related to professional training, disciplines and social groups while intellectual organization is related to concepts and theories in the fields to be organized. (4) The social perspective includes in addition the systems of genres and documents as well as the social system of knowledge producers, knowledge intermediaries and knowledge users. (5) This social system of documents, genres and agents makes available a very complicated structure of potential subject access points (SAPs), which may be used in information retrieval (IR). The basic aim of research in KO is to develop knowledge on how to optimise this system of SAPs and its utilization in IR. (6) SAPs may be seen as signs, and their production and use may be understood from a social semiotic point of view. (7) The concept of paradigms is also helpful because different groups and interests tend to be organized according to a paradigm and to develop different criteria of relevance, and thus different criteria of likeliness in KO. (8) The basic unit in KO is the semantic relation between two concepts, and such relations are embedded in theories. (9) In classification like things are grouped together, but what is considered similar is not a trivial question. (10) The paper concludes with the considering of methods for KO. Basically the methods of any field are connected with epistemological theories. This is also the case with KO. The existing methods as described in the literature of KO fit into a classification of basic epistemological views. The debate about the methods of KO at the deepest level therefore implies an epistemological discussion.","['articl', 'section', 'wide', 'interdisciplinari', 'much', 'broader', 'insid', 'mani', 'tradit', 'littl', 'mutual', 'influenc', 'tradit', 'larg', 'extent', 'defin', 'new', 'technolog', 'reason', 'theoret', 'integr', 'underpin', 'consid', 'import', 'technolog', 'driven', 'tradit', 'manual', 'refer', 'document', 'scientif', 'commun', 'storag', 'retriev', 'comput', 'citat', 'full', 'text', 'hypertext', 'internet', 'tradit', 'taken', 'togeth', 'defin', 'much', 'special', 'focu', 'research', 'import', 'establish', 'fruit', 'theoret', 'frame', 'refer', 'overal', 'suggest', 'import', 'theoret', 'distinct', 'consid', 'social', 'intellectu', 'form', 'social', 'form', 'relat', 'profession', 'train', 'disciplin', 'social', 'group', 'intellectu', 'relat', 'concept', 'theori', 'social', 'perspect', 'addit', 'system', 'genr', 'document', 'social', 'system', 'produc', 'intermediari', 'social', 'system', 'document', 'genr', 'agent', 'make', 'avail', 'complic', 'structur', 'potenti', 'access', 'sap', 'use', 'retriev', 'basic', 'aim', 'research', 'optimis', 'system', 'sap', 'util', 'sap', 'seen', 'sign', 'product', 'use', 'understood', 'social', 'semiot', 'view', 'concept', 'paradigm', 'help', 'group', 'interest', 'tend', 'accord', 'paradigm', 'criteria', 'relev', 'criteria', 'likeli', 'basic', 'unit', 'semant', 'relat', 'concept', 'relat', 'embed', 'theori', 'like', 'thing', 'group', 'togeth', 'consid', 'similar', 'trivial', 'question', 'conclud', 'consid', 'method', 'basic', 'method', 'connect', 'epistemolog', 'theori', 'case', 'exist', 'method', 'describ', 'literatur', 'fit', 'basic', 'epistemolog', 'view', 'debat', 'method', 'deepest', 'level', 'therefor', 'impli', 'epistemolog', 'discuss']",015-768-793-097-167,"The organisation of knowledge for exploitation and re-use in the modern enterprise is often a most perplexing challenge. The entire knowledge management life-cycle (for example - create, capture, organize, store, search, and transfer) is impacted by the organisation of intellectual capital into a corporate taxonomy or at the least a knowledge map (often incorrectly used interchangeably). Determining the extent to which such an objective is achieved is the focus of what is known as a knowledge audit. In this practice-oriented article, the authors review the fundamentals of creating a taxonomy, the use of meta-data in a necessary process known as classification and the role of expertise locators where the knowledge is not explicit but resides within experts in the form of tacit knowledge. The authors conclude with a framework for developing a corporate taxonomy and how such a project may be executed. The conceptual contribution of this article is the postulation that corporate taxonomies that are designed to facilitate knowledge audits lead to greater organizational impact.","['organis', 'exploit', 'use', 'modern', 'enterpris', 'often', 'perplex', 'challeng', 'entir', 'manag', 'life', 'cycl', 'exampl', 'creat', 'captur', 'store', 'search', 'transfer', 'impact', 'organis', 'intellectu', 'capit', 'corpor', 'taxonomi', 'least', 'map', 'often', 'incorrectli', 'use', 'interchang', 'determin', 'extent', 'object', 'achiev', 'focu', 'known', 'audit', 'practic', 'orient', 'articl', 'review', 'fundament', 'creat', 'taxonomi', 'use', 'meta', 'data', 'necessari', 'process', 'known', 'role', 'expertis', 'locat', 'explicit', 'resid', 'expert', 'form', 'tacit', 'conclud', 'framework', 'corpor', 'taxonomi', 'project', 'execut', 'conceptu', 'contribut', 'articl', 'postul', 'corpor', 'taxonomi', 'design', 'facilit', 'audit', 'lead', 'greater', 'organiz', 'impact']",,,
52,52hello,014-482-297-957-834,52,"Organizing and providing access to the resources on the Internet has been a problem area in spite of the availability of sophisticated search engines and other software tools. There have been several attempts to organize the resources on the World Wide Web. Some of them have tried to use traditional library classification schemes such as the Library of Congress Classification, the Dewey Decimal Classification and others. However there is a need to assign proper subject headings to them and present them in a logical or hierarchical sequence to cater to the need for browsing. This paper attempts to describe an experimental system designed to organize and provide access to web documents using a faceted pre-coordinate indexing system based on the Deep Structure Indexing System (DSIS) derived from POPSI (Postulate based Permuted Subject Indexing) of Bhattacharyya, and the facet analysis and chain indexing system of Ranganathan. A prototype software system has been designed to create a database of records specifying Web documents according to the Dublin Core and to input a faceted subject heading according to DSIS. Synonymous terms are added to the standard terms in the heading using appropriate symbols. Once the data are entered along with a description and the URL of the web document, the record is stored in the system. More than one faceted subject heading can be assigned to a record depending on the content of the original document. The system stores the surrogates and keeps the faceted subject headings separately after establishing a link. The search is carried out on index entries derived from the faceted subject heading using the chain indexing technique. If a single term is input, the system searches for its presence in the faceted subject headings and displays the subject headings in a sorted sequence reflecting an organizing sequence. If the number of retrieved headings is too large (running into more than a page) the user has the option of entering another search term to be searched in combination. The system searches subject headings already retrieved and looks for those containing the second term. The retrieved faceted subject headings can be displayed and browsed. When the relevant subject heading is selected the system displays the records with their URLs. Using the URL, the original document on the web can be accessed. The prototype system developed in a Windows NT environment using ASP and a web server is under rigorous testing. The database and index management routines need further development.","['access', 'resourc', 'internet', 'problem', 'area', 'spite', 'avail', 'sophist', 'search', 'engin', 'softwar', 'tool', 'sever', 'attempt', 'resourc', 'world', 'wide', 'web', 'tri', 'use', 'tradit', 'scheme', 'congress', 'dewey', 'decim', 'other', 'howev', 'assign', 'proper', 'head', 'logic', 'hierarch', 'sequenc', 'cater', 'brows', 'attempt', 'describ', 'experiment', 'system', 'design', 'access', 'web', 'document', 'use', 'facet', 'coordin', 'system', 'deep', 'structur', 'system', 'deriv', 'popsi', 'postul', 'permut', 'bhattacharyya', 'facet', 'analysi', 'chain', 'system', 'ranganathan', 'prototyp', 'softwar', 'system', 'design', 'creat', 'databas', 'record', 'specifi', 'web', 'document', 'accord', 'dublin', 'core', 'input', 'facet', 'head', 'accord', 'synonym', 'ad', 'standard', 'head', 'use', 'appropri', 'symbol', 'data', 'enter', 'along', 'descript', 'url', 'web', 'document', 'record', 'store', 'system', 'facet', 'head', 'assign', 'record', 'depend', 'content', 'origin', 'document', 'system', 'store', 'surrog', 'facet', 'head', 'separ', 'establish', 'link', 'search', 'carri', 'entri', 'deriv', 'facet', 'head', 'use', 'chain', 'techniqu', 'singl', 'input', 'system', 'search', 'presenc', 'facet', 'head', 'display', 'head', 'sort', 'sequenc', 'reflect', 'sequenc', 'number', 'retriev', 'head', 'larg', 'run', 'page', 'option', 'enter', 'anoth', 'search', 'search', 'combin', 'system', 'search', 'head', 'alreadi', 'retriev', 'look', 'contain', 'second', 'retriev', 'facet', 'head', 'display', 'brows', 'relev', 'head', 'select', 'system', 'display', 'record', 'url', 'use', 'url', 'origin', 'document', 'web', 'access', 'prototyp', 'system', 'window', 'environ', 'use', 'web', 'server', 'rigor', 'test', 'databas', 'manag', 'routin']",194-556-078-156-224,"Different approaches to the classification of a knowledge field include empiristic, rationalistic, historicist, and pragmatic methods. This paper demonstrates how these different methods have been applied to the classification of psychology. An etymological approach is insufficient to define the subject matter of psychology, because other terms can be used to describe the same domain. To define the subject matter of psychology from the point of view of its formal establishment as a science and academic discipline (in Leipzig, 1879) is also insufficient because this was done in specific historical circumstances, which narrowed the subject matter to physiologically-related issues. When defining the subject area of a scientific field it is necessary to consider how different ontological and epistemological views have made their influences. A subject area and the approaches by which this subject area has been studied cannot be separated from each other without tracing their mutual historical interactions. The classification of a subject field is theory-laden and thus cannot be neutral or ahistorical. If classification research can claim to have a method that is more general than the study of the concrete developments in the single knowledge fields the key is to be found in the general epistemological theories. It is shown how basic epistemological assumptions have formed the different approaches to psychology during the 20th century. The progress in the understanding of basic philosophical questions is decisive both for the development of a knowledge field and as the point of departure of classification. The theoretical principles developed in this paper are applied in a brief analysis of some concrete classification systems, including the one used by PsycINFO / Psychological Abstracts. The role of classification in modern information retrieval is also briefly discussed.","['empirist', 'rationalist', 'historicist', 'pragmat', 'method', 'demonstr', 'method', 'appli', 'psycholog', 'etymolog', 'insuffici', 'defin', 'matter', 'psycholog', 'use', 'describ', 'domain', 'defin', 'matter', 'psycholog', 'view', 'formal', 'establish', 'academ', 'disciplin', 'leipzig', '1879', 'insuffici', 'done', 'specif', 'histor', 'circumst', 'narrow', 'matter', 'physiolog', 'relat', 'issu', 'defin', 'area', 'scientif', 'necessari', 'consid', 'ontolog', 'epistemolog', 'view', 'made', 'influenc', 'area', 'area', 'cannot', 'separ', 'without', 'trace', 'mutual', 'histor', 'interact', 'theori', 'laden', 'cannot', 'neutral', 'ahistor', 'research', 'claim', 'method', 'gener', 'concret', 'singl', 'key', 'found', 'gener', 'epistemolog', 'theori', 'shown', 'basic', 'epistemolog', 'assumpt', 'form', 'psycholog', 'centuri', 'progress', 'understand', 'basic', 'philosoph', 'question', 'decis', 'departur', 'theoret', 'principl', 'appli', 'brief', 'analysi', 'concret', 'system', 'use', 'psycinfo', 'psycholog', 'abstract', 'role', 'modern', 'retriev', 'briefli', 'discuss']",,,
53,53hello,194-391-518-246-985,53,"This article is organized in 10 sections: (1) Knowledge Organization (KO) is a wide interdisciplinary field, much broader than Library and Information Science (LIS). (2) Inside LIS there have been many different approaches and traditions of KO with little mutual influence. These traditions have to a large extent been defined by new technology, for which reason the theoretical integration and underpinning has not been well considered. The most important technology-driven traditions are: a) Manual indexing and classification in libraries and reference works, b) Documentation and scientific communication, c) Information storage and retrieval by computers, d) Citation based KO and e) Full text, hypertext and Internet based approaches. These traditions taken together define very much the special LIS focus on KO. For KO as a field of research it is important to establish a fruitful theoretical frame of reference for this overall field. This paper provides some suggestions. (3) One important, theoretical distinction to consider is the one between social and intellectual forms of KO. Social forms of KO are related to professional training, disciplines and social groups while intellectual organization is related to concepts and theories in the fields to be organized. (4) The social perspective includes in addition the systems of genres and documents as well as the social system of knowledge producers, knowledge intermediaries and knowledge users. (5) This social system of documents, genres and agents makes available a very complicated structure of potential subject access points (SAPs), which may be used in information retrieval (IR). The basic aim of research in KO is to develop knowledge on how to optimise this system of SAPs and its utilization in IR. (6) SAPs may be seen as signs, and their production and use may be understood from a social semiotic point of view. (7) The concept of paradigms is also helpful because different groups and interests tend to be organized according to a paradigm and to develop different criteria of relevance, and thus different criteria of likeliness in KO. (8) The basic unit in KO is the semantic relation between two concepts, and such relations are embedded in theories. (9) In classification like things are grouped together, but what is considered similar is not a trivial question. (10) The paper concludes with the considering of methods for KO. Basically the methods of any field are connected with epistemological theories. This is also the case with KO. The existing methods as described in the literature of KO fit into a classification of basic epistemological views. The debate about the methods of KO at the deepest level therefore implies an epistemological discussion.","['articl', 'section', 'wide', 'interdisciplinari', 'much', 'broader', 'insid', 'mani', 'tradit', 'littl', 'mutual', 'influenc', 'tradit', 'larg', 'extent', 'defin', 'new', 'technolog', 'reason', 'theoret', 'integr', 'underpin', 'consid', 'import', 'technolog', 'driven', 'tradit', 'manual', 'refer', 'document', 'scientif', 'commun', 'storag', 'retriev', 'comput', 'citat', 'full', 'text', 'hypertext', 'internet', 'tradit', 'taken', 'togeth', 'defin', 'much', 'special', 'focu', 'research', 'import', 'establish', 'fruit', 'theoret', 'frame', 'refer', 'overal', 'suggest', 'import', 'theoret', 'distinct', 'consid', 'social', 'intellectu', 'form', 'social', 'form', 'relat', 'profession', 'train', 'disciplin', 'social', 'group', 'intellectu', 'relat', 'concept', 'theori', 'social', 'perspect', 'addit', 'system', 'genr', 'document', 'social', 'system', 'produc', 'intermediari', 'social', 'system', 'document', 'genr', 'agent', 'make', 'avail', 'complic', 'structur', 'potenti', 'access', 'sap', 'use', 'retriev', 'basic', 'aim', 'research', 'optimis', 'system', 'sap', 'util', 'sap', 'seen', 'sign', 'product', 'use', 'understood', 'social', 'semiot', 'view', 'concept', 'paradigm', 'help', 'group', 'interest', 'tend', 'accord', 'paradigm', 'criteria', 'relev', 'criteria', 'likeli', 'basic', 'unit', 'semant', 'relat', 'concept', 'relat', 'embed', 'theori', 'like', 'thing', 'group', 'togeth', 'consid', 'similar', 'trivial', 'question', 'conclud', 'consid', 'method', 'basic', 'method', 'connect', 'epistemolog', 'theori', 'case', 'exist', 'method', 'describ', 'literatur', 'fit', 'basic', 'epistemolog', 'view', 'debat', 'method', 'deepest', 'level', 'therefor', 'impli', 'epistemolog', 'discuss']",017-656-214-265-143,"Automatic subject indexing addresses problems of scale and sustainability and can be at the same time used to enrich existing metadata records, establish more connections across and between resourc ...","['automat', 'address', 'problem', 'scale', 'sustain', 'time', 'use', 'enrich', 'exist', 'metadata', 'record', 'establish', 'connect', 'across', 'resourc']",,,
54,54hello,194-391-518-246-985,54,"This article is organized in 10 sections: (1) Knowledge Organization (KO) is a wide interdisciplinary field, much broader than Library and Information Science (LIS). (2) Inside LIS there have been many different approaches and traditions of KO with little mutual influence. These traditions have to a large extent been defined by new technology, for which reason the theoretical integration and underpinning has not been well considered. The most important technology-driven traditions are: a) Manual indexing and classification in libraries and reference works, b) Documentation and scientific communication, c) Information storage and retrieval by computers, d) Citation based KO and e) Full text, hypertext and Internet based approaches. These traditions taken together define very much the special LIS focus on KO. For KO as a field of research it is important to establish a fruitful theoretical frame of reference for this overall field. This paper provides some suggestions. (3) One important, theoretical distinction to consider is the one between social and intellectual forms of KO. Social forms of KO are related to professional training, disciplines and social groups while intellectual organization is related to concepts and theories in the fields to be organized. (4) The social perspective includes in addition the systems of genres and documents as well as the social system of knowledge producers, knowledge intermediaries and knowledge users. (5) This social system of documents, genres and agents makes available a very complicated structure of potential subject access points (SAPs), which may be used in information retrieval (IR). The basic aim of research in KO is to develop knowledge on how to optimise this system of SAPs and its utilization in IR. (6) SAPs may be seen as signs, and their production and use may be understood from a social semiotic point of view. (7) The concept of paradigms is also helpful because different groups and interests tend to be organized according to a paradigm and to develop different criteria of relevance, and thus different criteria of likeliness in KO. (8) The basic unit in KO is the semantic relation between two concepts, and such relations are embedded in theories. (9) In classification like things are grouped together, but what is considered similar is not a trivial question. (10) The paper concludes with the considering of methods for KO. Basically the methods of any field are connected with epistemological theories. This is also the case with KO. The existing methods as described in the literature of KO fit into a classification of basic epistemological views. The debate about the methods of KO at the deepest level therefore implies an epistemological discussion.","['articl', 'section', 'wide', 'interdisciplinari', 'much', 'broader', 'insid', 'mani', 'tradit', 'littl', 'mutual', 'influenc', 'tradit', 'larg', 'extent', 'defin', 'new', 'technolog', 'reason', 'theoret', 'integr', 'underpin', 'consid', 'import', 'technolog', 'driven', 'tradit', 'manual', 'refer', 'document', 'scientif', 'commun', 'storag', 'retriev', 'comput', 'citat', 'full', 'text', 'hypertext', 'internet', 'tradit', 'taken', 'togeth', 'defin', 'much', 'special', 'focu', 'research', 'import', 'establish', 'fruit', 'theoret', 'frame', 'refer', 'overal', 'suggest', 'import', 'theoret', 'distinct', 'consid', 'social', 'intellectu', 'form', 'social', 'form', 'relat', 'profession', 'train', 'disciplin', 'social', 'group', 'intellectu', 'relat', 'concept', 'theori', 'social', 'perspect', 'addit', 'system', 'genr', 'document', 'social', 'system', 'produc', 'intermediari', 'social', 'system', 'document', 'genr', 'agent', 'make', 'avail', 'complic', 'structur', 'potenti', 'access', 'sap', 'use', 'retriev', 'basic', 'aim', 'research', 'optimis', 'system', 'sap', 'util', 'sap', 'seen', 'sign', 'product', 'use', 'understood', 'social', 'semiot', 'view', 'concept', 'paradigm', 'help', 'group', 'interest', 'tend', 'accord', 'paradigm', 'criteria', 'relev', 'criteria', 'likeli', 'basic', 'unit', 'semant', 'relat', 'concept', 'relat', 'embed', 'theori', 'like', 'thing', 'group', 'togeth', 'consid', 'similar', 'trivial', 'question', 'conclud', 'consid', 'method', 'basic', 'method', 'connect', 'epistemolog', 'theori', 'case', 'exist', 'method', 'describ', 'literatur', 'fit', 'basic', 'epistemolog', 'view', 'debat', 'method', 'deepest', 'level', 'therefor', 'impli', 'epistemolog', 'discuss']",004-982-241-501-860,"The subject of this article is folksonomies on the Internet. One of the largest folksonomies on the Internet in terms of number of users and tagged websites is the computer program del.icio.us, where more than 100,000 people have tagged the websites that they and others find using their own keywords. How this is done in practice and the patterns to be found are the focus of this article. The empirical basis is the collection of 76,601 different keywords with a total frequency of 178,215 from 500 randomly chosen taggers on del.icio.us. at the end of 2005. The keywords collected were then analyzed quantitatively statistically by uncovering their frequency and percentage distribution and through a statistical correspondence analysis in order to uncover possible patterns in the users' tags. Subsequently, a qualitative textual analysis of the tags was made in order to find out by analysis which tagging strategies are represented in the data material. This led to four conclusions. 1) the distribution of keywords follows classic power law; 2) distinct tagging communities are identifiable; 3) the most frequently used tags are situated on a general-specific axis; and 4) nine distinct tagging strategies are observed. These four conclusions are put into perspective collectively in respect of a number of more general and theoretical considerations concerning folksonomies and the classification systems of the future.","['articl', 'folksonomi', 'internet', 'largest', 'folksonomi', 'internet', 'number', 'tag', 'websit', 'comput', 'program', 'icio', '000', 'peopl', 'tag', 'websit', 'other', 'find', 'use', 'keyword', 'done', 'practic', 'pattern', 'found', 'focu', 'articl', 'empir', 'basi', 'collect', 'keyword', 'total', 'frequenc', 'randomli', 'chosen', 'tagger', 'icio', '2005', 'keyword', 'collect', 'analyz', 'quantit', 'statist', 'uncov', 'frequenc', 'percentag', 'distribut', 'statist', 'correspond', 'analysi', 'order', 'uncov', 'possibl', 'pattern', 'tag', 'subsequ', 'qualit', 'textual', 'analysi', 'tag', 'made', 'order', 'find', 'analysi', 'tag', 'strategi', 'repres', 'data', 'materi', 'conclus', 'distribut', 'keyword', 'follow', 'classic', 'power', 'distinct', 'tag', 'commun', 'identifi', 'frequent', 'use', 'tag', 'situat', 'gener', 'specif', 'nine', 'distinct', 'tag', 'strategi', 'observ', 'conclus', 'perspect', 'collect', 'respect', 'number', 'gener', 'theoret', 'consider', 'concern', 'folksonomi', 'system', 'futur']",,,
