,new_index,Lens ID_Train,index,Abstract_Train,Abstract_trim_2_Train,Lens ID_Test,Abstract_Test,Abstract_trim_2_Test,Dickson,Andy,Bill
17,17hello,194-391-518-246-985,17,"This article is organized in 10 sections: (1) Knowledge Organization (KO) is a wide interdisciplinary field, much broader than Library and Information Science (LIS). (2) Inside LIS there have been many different approaches and traditions of KO with little mutual influence. These traditions have to a large extent been defined by new technology, for which reason the theoretical integration and underpinning has not been well considered. The most important technology-driven traditions are: a) Manual indexing and classification in libraries and reference works, b) Documentation and scientific communication, c) Information storage and retrieval by computers, d) Citation based KO and e) Full text, hypertext and Internet based approaches. These traditions taken together define very much the special LIS focus on KO. For KO as a field of research it is important to establish a fruitful theoretical frame of reference for this overall field. This paper provides some suggestions. (3) One important, theoretical distinction to consider is the one between social and intellectual forms of KO. Social forms of KO are related to professional training, disciplines and social groups while intellectual organization is related to concepts and theories in the fields to be organized. (4) The social perspective includes in addition the systems of genres and documents as well as the social system of knowledge producers, knowledge intermediaries and knowledge users. (5) This social system of documents, genres and agents makes available a very complicated structure of potential subject access points (SAPs), which may be used in information retrieval (IR). The basic aim of research in KO is to develop knowledge on how to optimise this system of SAPs and its utilization in IR. (6) SAPs may be seen as signs, and their production and use may be understood from a social semiotic point of view. (7) The concept of paradigms is also helpful because different groups and interests tend to be organized according to a paradigm and to develop different criteria of relevance, and thus different criteria of likeliness in KO. (8) The basic unit in KO is the semantic relation between two concepts, and such relations are embedded in theories. (9) In classification like things are grouped together, but what is considered similar is not a trivial question. (10) The paper concludes with the considering of methods for KO. Basically the methods of any field are connected with epistemological theories. This is also the case with KO. The existing methods as described in the literature of KO fit into a classification of basic epistemological views. The debate about the methods of KO at the deepest level therefore implies an epistemological discussion.","['articl', 'section', 'wide', 'interdisciplinari', 'much', 'broader', 'insid', 'mani', 'tradit', 'littl', 'mutual', 'influenc', 'tradit', 'larg', 'extent', 'defin', 'new', 'technolog', 'reason', 'theoret', 'integr', 'underpin', 'consid', 'import', 'technolog', 'driven', 'tradit', 'manual', 'refer', 'document', 'scientif', 'commun', 'storag', 'retriev', 'comput', 'citat', 'full', 'text', 'hypertext', 'internet', 'tradit', 'taken', 'togeth', 'defin', 'much', 'special', 'focu', 'research', 'import', 'establish', 'fruit', 'theoret', 'frame', 'refer', 'overal', 'suggest', 'import', 'theoret', 'distinct', 'consid', 'social', 'intellectu', 'form', 'social', 'form', 'relat', 'profession', 'train', 'disciplin', 'social', 'group', 'intellectu', 'relat', 'concept', 'theori', 'social', 'perspect', 'addit', 'system', 'genr', 'document', 'social', 'system', 'produc', 'intermediari', 'social', 'system', 'document', 'genr', 'agent', 'make', 'avail', 'complic', 'structur', 'potenti', 'access', 'sap', 'use', 'retriev', 'basic', 'aim', 'research', 'optimis', 'system', 'sap', 'util', 'sap', 'seen', 'sign', 'product', 'use', 'understood', 'social', 'semiot', 'view', 'concept', 'paradigm', 'help', 'group', 'interest', 'tend', 'accord', 'paradigm', 'criteria', 'relev', 'criteria', 'likeli', 'basic', 'unit', 'semant', 'relat', 'concept', 'relat', 'embed', 'theori', 'like', 'thing', 'group', 'togeth', 'consid', 'similar', 'trivial', 'question', 'conclud', 'consid', 'method', 'basic', 'method', 'connect', 'epistemolog', 'theori', 'case', 'exist', 'method', 'describ', 'literatur', 'fit', 'basic', 'epistemolog', 'view', 'debat', 'method', 'deepest', 'level', 'therefor', 'impli', 'epistemolog', 'discuss']",007-409-477-173-741,"Paper presented at the 2nd ISKO Italy-UniMIB meeting, Milan, June 9 2006: http://www.iskoi.org/doc/milano06.htm; Different classification schemes may be used for web indexing. The authors analyze three weblogs (Biblioatipici, Letture and Andrea Marchitelli’s blog) to demonstrate that different contents may be classified using the appropriate scheme.; Biblioatipici is a weblog about temporary workers in libraries and Italian documentation centres, indexed with a faceted scheme, home made by authors. Letture, a diary about reading and books, is indexed by DDC; finally, Andrea Marchitelli’s blog, a weblog about digital libraries and open access, is indexed by JITA, the scheme used for indexing e-prints in some different open archives.; The three applications are presented starting from the most complex scheme (i.e. the faceted one) to the simple but least functional (JITA), passing through a traditional bibliographic classification scheme, the Dewey Decimal Classification.; The analysis demonstrates that different web contents can efficiently be classified with different schemes. In particular, with the facets one (Biblioatipici) the indexer is able to generate the needed classes in the indexing phase. Moreover with a small number of facets and foci one can obtain an exponential number of classes. Finally, one of the advantages for the user is that the faceted scheme allows multiple accesses on the basis of different information requirements, in addition to being coherent and intuitive. DDC scheme can be more suitable than the first web pages or blogs performing a sort of digital library. In this case in fact the DDC scheme constitutes a consolidated classification standard, widespread in a huge quantity of libraries and the use of a different scheme might get confusion. JITA scheme, finally, can find a huge applicability in web pages (or blogs) in LIS field showing several advantages: it’s very simple and essentialy pragmatic, intuitive and coherent. It’s a conservative scheme because structurally closed, in fact it does not allow the classifier to insert new LCS’s categories. If, from a certain point of view, this is a disadvantage, vice versa this feature is really useful because get a complete matching between classes of all the web pages implemented with it.","['isko', 'itali', 'unimib', 'meet', 'milan', 'june', '2006', 'milano06', 'scheme', 'use', 'web', 'analyz', 'weblog', 'biblioatipici', 'lettur', 'andrea', 'marchitelli', 'blog', 'demonstr', 'content', 'classifi', 'use', 'appropri', 'scheme', 'biblioatipici', 'weblog', 'temporari', 'worker', 'italian', 'document', 'centr', 'facet', 'scheme', 'home', 'made', 'lettur', 'diari', 'read', 'book', 'final', 'andrea', 'marchitelli', 'blog', 'weblog', 'digit', 'open', 'access', 'jita', 'scheme', 'use', 'print', 'open', 'archiv', 'applic', 'start', 'complex', 'scheme', 'facet', 'simpl', 'least', 'function', 'jita', 'pass', 'tradit', 'bibliograph', 'scheme', 'dewey', 'decim', 'analysi', 'demonstr', 'web', 'content', 'effici', 'classifi', 'scheme', 'particular', 'facet', 'biblioatipici', 'abl', 'gener', 'class', 'phase', 'moreov', 'small', 'number', 'facet', 'foci', 'obtain', 'exponenti', 'number', 'class', 'final', 'advantag', 'facet', 'scheme', 'allow', 'multipl', 'access', 'basi', 'requir', 'addit', 'coher', 'intuit', 'scheme', 'suitabl', 'first', 'web', 'page', 'blog', 'perform', 'sort', 'digit', 'case', 'fact', 'scheme', 'constitut', 'consolid', 'standard', 'widespread', 'huge', 'quantiti', 'use', 'scheme', 'might', 'confus', 'jita', 'scheme', 'final', 'find', 'huge', 'applic', 'web', 'page', 'blog', 'show', 'sever', 'advantag', 'simpl', 'essentiali', 'pragmat', 'intuit', 'coher', 'conserv', 'scheme', 'structur', 'close', 'fact', 'allow', 'classifi', 'insert', 'new', 'categori', 'certain', 'view', 'disadvantag', 'vice', 'versa', 'featur', 'realli', 'use', 'complet', 'match', 'class', 'web', 'page', 'implement']",,,
18,18hello,094-882-702-642-495,18,"We sketch the historic transformation of culturally grown techniques of symbol manipulation, such as basic arithmetic in the decimal number system, to the full-fledged version of the Computational Theory of Mind. Symbol manipulation systems had been considered by Leibniz as a methodology of inferring knowledge in a secure and purely mechanical fashion. Such inference calculi were considered as mere artefacts which could not possibly encompass all human knowledge acquisition. In Alan Turing's work one notices a crucial shift of perspective. The abstract mathematical states of a Turing machine (a kind of calculus universalis that Leibniz was looking for) are claimed to correspond to equivalent psychological states. Artefacts are turned into faithful models of human cognition. A further step toward the Computational Theory of Mind was the physical symbol system hypothesis, contending to have found a necessary and sufficient criterion for the presence of intelligence in operative mediums. This, together with Chomsky's foundational work on linguistics, led naturally to the Computational Theory of Mind as set out by Jerry Fodor and Zenon Pylyshyn. We discuss problematic aspects of this theory. Then we deal with another paradigm of the Computational Theory of Mind based on network automata. This sub-symbolic paradigm seems to avoid problems occuring in symbolic computations, like the proble frame problem and graceful degradation","['sketch', 'histor', 'transform', 'cultur', 'grown', 'techniqu', 'symbol', 'manipul', 'basic', 'arithmet', 'decim', 'number', 'system', 'full', 'fledg', 'version', 'comput', 'theori', 'mind', 'symbol', 'manipul', 'system', 'consid', 'leibniz', 'methodolog', 'infer', 'secur', 'pure', 'mechan', 'fashion', 'infer', 'calculi', 'consid', 'mere', 'artefact', 'could', 'possibl', 'encompass', 'human', 'acquisit', 'alan', 'ture', 'notic', 'crucial', 'shift', 'perspect', 'abstract', 'mathemat', 'state', 'ture', 'machin', 'kind', 'calculu', 'universali', 'leibniz', 'look', 'claim', 'correspond', 'equival', 'psycholog', 'state', 'artefact', 'turn', 'faith', 'model', 'human', 'cognit', 'step', 'toward', 'comput', 'theori', 'mind', 'physic', 'symbol', 'system', 'hypothesi', 'contend', 'found', 'necessari', 'suffici', 'criterion', 'presenc', 'intellig', 'oper', 'medium', 'togeth', 'chomski', 'foundat', 'linguist', 'natur', 'comput', 'theori', 'mind', 'jerri', 'fodor', 'zenon', 'pylyshyn', 'discuss', 'problemat', 'aspect', 'theori', 'deal', 'anoth', 'paradigm', 'comput', 'theori', 'mind', 'network', 'automata', 'symbol', 'paradigm', 'seem', 'avoid', 'problem', 'occur', 'symbol', 'comput', 'like', 'probl', 'frame', 'problem', 'grace', 'degrad']",045-388-908-940-286,"<p>The lack of standardization in the production, organization and dissemination of information in documentation centers and institutions alike, as a result from the digitization of collections and their availability on the internet has called for integration efforts. The sheer availability of multimedia content has fostered the development of many distinct and, most of the time, independent metadata standards for its description. This study aims at presenting and comparing the existing standards of metadata, vocabularies and ontologies for multimedia annotation and also tries to offer a synthetic overview of its main strengths and weaknesses, aiding efforts for semantic integration and enhancing the findability of available multimedia resources on the web. We also aim at unveiling the characteristics that could, should and are perhaps not being highlighted in the characterization of multimedia resources. </p>","['lack', 'standard', 'product', 'dissemin', 'document', 'center', 'institut', 'alik', 'result', 'digit', 'collect', 'avail', 'internet', 'call', 'integr', 'effort', 'sheer', 'avail', 'multimedia', 'content', 'foster', 'mani', 'distinct', 'time', 'independ', 'metadata', 'standard', 'descript', 'aim', 'compar', 'exist', 'standard', 'metadata', 'vocabulari', 'ontolog', 'multimedia', 'annot', 'tri', 'offer', 'synthet', 'overview', 'main', 'strength', 'weak', 'aid', 'effort', 'semant', 'integr', 'enhanc', 'findabl', 'avail', 'multimedia', 'resourc', 'web', 'aim', 'unveil', 'characterist', 'could', 'perhap', 'highlight', 'character', 'multimedia', 'resourc']",,,
19,19hello,194-391-518-246-985,19,"This article is organized in 10 sections: (1) Knowledge Organization (KO) is a wide interdisciplinary field, much broader than Library and Information Science (LIS). (2) Inside LIS there have been many different approaches and traditions of KO with little mutual influence. These traditions have to a large extent been defined by new technology, for which reason the theoretical integration and underpinning has not been well considered. The most important technology-driven traditions are: a) Manual indexing and classification in libraries and reference works, b) Documentation and scientific communication, c) Information storage and retrieval by computers, d) Citation based KO and e) Full text, hypertext and Internet based approaches. These traditions taken together define very much the special LIS focus on KO. For KO as a field of research it is important to establish a fruitful theoretical frame of reference for this overall field. This paper provides some suggestions. (3) One important, theoretical distinction to consider is the one between social and intellectual forms of KO. Social forms of KO are related to professional training, disciplines and social groups while intellectual organization is related to concepts and theories in the fields to be organized. (4) The social perspective includes in addition the systems of genres and documents as well as the social system of knowledge producers, knowledge intermediaries and knowledge users. (5) This social system of documents, genres and agents makes available a very complicated structure of potential subject access points (SAPs), which may be used in information retrieval (IR). The basic aim of research in KO is to develop knowledge on how to optimise this system of SAPs and its utilization in IR. (6) SAPs may be seen as signs, and their production and use may be understood from a social semiotic point of view. (7) The concept of paradigms is also helpful because different groups and interests tend to be organized according to a paradigm and to develop different criteria of relevance, and thus different criteria of likeliness in KO. (8) The basic unit in KO is the semantic relation between two concepts, and such relations are embedded in theories. (9) In classification like things are grouped together, but what is considered similar is not a trivial question. (10) The paper concludes with the considering of methods for KO. Basically the methods of any field are connected with epistemological theories. This is also the case with KO. The existing methods as described in the literature of KO fit into a classification of basic epistemological views. The debate about the methods of KO at the deepest level therefore implies an epistemological discussion.","['articl', 'section', 'wide', 'interdisciplinari', 'much', 'broader', 'insid', 'mani', 'tradit', 'littl', 'mutual', 'influenc', 'tradit', 'larg', 'extent', 'defin', 'new', 'technolog', 'reason', 'theoret', 'integr', 'underpin', 'consid', 'import', 'technolog', 'driven', 'tradit', 'manual', 'refer', 'document', 'scientif', 'commun', 'storag', 'retriev', 'comput', 'citat', 'full', 'text', 'hypertext', 'internet', 'tradit', 'taken', 'togeth', 'defin', 'much', 'special', 'focu', 'research', 'import', 'establish', 'fruit', 'theoret', 'frame', 'refer', 'overal', 'suggest', 'import', 'theoret', 'distinct', 'consid', 'social', 'intellectu', 'form', 'social', 'form', 'relat', 'profession', 'train', 'disciplin', 'social', 'group', 'intellectu', 'relat', 'concept', 'theori', 'social', 'perspect', 'addit', 'system', 'genr', 'document', 'social', 'system', 'produc', 'intermediari', 'social', 'system', 'document', 'genr', 'agent', 'make', 'avail', 'complic', 'structur', 'potenti', 'access', 'sap', 'use', 'retriev', 'basic', 'aim', 'research', 'optimis', 'system', 'sap', 'util', 'sap', 'seen', 'sign', 'product', 'use', 'understood', 'social', 'semiot', 'view', 'concept', 'paradigm', 'help', 'group', 'interest', 'tend', 'accord', 'paradigm', 'criteria', 'relev', 'criteria', 'likeli', 'basic', 'unit', 'semant', 'relat', 'concept', 'relat', 'embed', 'theori', 'like', 'thing', 'group', 'togeth', 'consid', 'similar', 'trivial', 'question', 'conclud', 'consid', 'method', 'basic', 'method', 'connect', 'epistemolog', 'theori', 'case', 'exist', 'method', 'describ', 'literatur', 'fit', 'basic', 'epistemolog', 'view', 'debat', 'method', 'deepest', 'level', 'therefor', 'impli', 'epistemolog', 'discuss']",063-359-887-330-154,"The Underground Railroad was a network of people who helped fugitive slaves escape to the North and Canada during the U.S. Civil War period, beginning in about 1831.Quilting was used as a form of information representation (Breneman 2001). This simple classification was designed to relate the symbolic transmission of escape routes and locations of sanctuary. Because it was for use in a children's library, symbolic representations were used to anchor the classes. Symbols are based in the African graphic arts, the Adinkra symbols of Ghana (West African wisdom. 2001), and also from actual quilt practice (Threads of Freedom 2001 and Breneman 2001).","['underground', 'railroad', 'network', 'peopl', 'help', 'fugit', 'slave', 'escap', 'north', 'canada', 'u', 'civil', 'war', 'period', 'begin', '1831', 'quilt', 'use', 'form', 'represent', 'breneman', '2001', 'simpl', 'design', 'relat', 'symbol', 'transmiss', 'escap', 'rout', 'locat', 'sanctuari', 'use', 'children', 'symbol', 'represent', 'use', 'anchor', 'class', 'symbol', 'african', 'graphic', 'art', 'adinkra', 'symbol', 'ghana', 'west', 'african', 'wisdom', '2001', 'actual', 'quilt', 'practic', 'thread', 'freedom', '2001', 'breneman', '2001']",,,
20,20hello,014-482-297-957-834,20,"Organizing and providing access to the resources on the Internet has been a problem area in spite of the availability of sophisticated search engines and other software tools. There have been several attempts to organize the resources on the World Wide Web. Some of them have tried to use traditional library classification schemes such as the Library of Congress Classification, the Dewey Decimal Classification and others. However there is a need to assign proper subject headings to them and present them in a logical or hierarchical sequence to cater to the need for browsing. This paper attempts to describe an experimental system designed to organize and provide access to web documents using a faceted pre-coordinate indexing system based on the Deep Structure Indexing System (DSIS) derived from POPSI (Postulate based Permuted Subject Indexing) of Bhattacharyya, and the facet analysis and chain indexing system of Ranganathan. A prototype software system has been designed to create a database of records specifying Web documents according to the Dublin Core and to input a faceted subject heading according to DSIS. Synonymous terms are added to the standard terms in the heading using appropriate symbols. Once the data are entered along with a description and the URL of the web document, the record is stored in the system. More than one faceted subject heading can be assigned to a record depending on the content of the original document. The system stores the surrogates and keeps the faceted subject headings separately after establishing a link. The search is carried out on index entries derived from the faceted subject heading using the chain indexing technique. If a single term is input, the system searches for its presence in the faceted subject headings and displays the subject headings in a sorted sequence reflecting an organizing sequence. If the number of retrieved headings is too large (running into more than a page) the user has the option of entering another search term to be searched in combination. The system searches subject headings already retrieved and looks for those containing the second term. The retrieved faceted subject headings can be displayed and browsed. When the relevant subject heading is selected the system displays the records with their URLs. Using the URL, the original document on the web can be accessed. The prototype system developed in a Windows NT environment using ASP and a web server is under rigorous testing. The database and index management routines need further development.","['access', 'resourc', 'internet', 'problem', 'area', 'spite', 'avail', 'sophist', 'search', 'engin', 'softwar', 'tool', 'sever', 'attempt', 'resourc', 'world', 'wide', 'web', 'tri', 'use', 'tradit', 'scheme', 'congress', 'dewey', 'decim', 'other', 'howev', 'assign', 'proper', 'head', 'logic', 'hierarch', 'sequenc', 'cater', 'brows', 'attempt', 'describ', 'experiment', 'system', 'design', 'access', 'web', 'document', 'use', 'facet', 'coordin', 'system', 'deep', 'structur', 'system', 'deriv', 'popsi', 'postul', 'permut', 'bhattacharyya', 'facet', 'analysi', 'chain', 'system', 'ranganathan', 'prototyp', 'softwar', 'system', 'design', 'creat', 'databas', 'record', 'specifi', 'web', 'document', 'accord', 'dublin', 'core', 'input', 'facet', 'head', 'accord', 'synonym', 'ad', 'standard', 'head', 'use', 'appropri', 'symbol', 'data', 'enter', 'along', 'descript', 'url', 'web', 'document', 'record', 'store', 'system', 'facet', 'head', 'assign', 'record', 'depend', 'content', 'origin', 'document', 'system', 'store', 'surrog', 'facet', 'head', 'separ', 'establish', 'link', 'search', 'carri', 'entri', 'deriv', 'facet', 'head', 'use', 'chain', 'techniqu', 'singl', 'input', 'system', 'search', 'presenc', 'facet', 'head', 'display', 'head', 'sort', 'sequenc', 'reflect', 'sequenc', 'number', 'retriev', 'head', 'larg', 'run', 'page', 'option', 'enter', 'anoth', 'search', 'search', 'combin', 'system', 'search', 'head', 'alreadi', 'retriev', 'look', 'contain', 'second', 'retriev', 'facet', 'head', 'display', 'brows', 'relev', 'head', 'select', 'system', 'display', 'record', 'url', 'use', 'url', 'origin', 'document', 'web', 'access', 'prototyp', 'system', 'window', 'environ', 'use', 'web', 'server', 'rigor', 'test', 'databas', 'manag', 'routin']",006-131-603-403-086,"<p>Cultural heritage institutions are publishing their digital collections over the web as LOD. This is is a new step in the patrimonialization and curatorial processes developed by such institutions. Many of these collections are thematically superimposed and complementary. Frequently, objects in these collections present culturally relevant relationships, such as a book about a painting, or a draft or sketch of a famous painting, etc. LOD technology enables such heritage records to be interlinked, achieving interoperability and adding value to digital collections, thus empowering heritage institutions. An aim of this research is characterizing such culturally relevant relationships and organizing them in a vocabulary. Use cases or examples of relationships between objects suggested by curators or mentioned in literature and in the conceptual models as FRBR/LRM, CIDOC CRM and RiC-CM, were collected and used as examples or inspiration of cultural relevant relationships. Relationships identified are collated and compared for identifying those with the same or similar meaning, synthesized and normalized. A set of thirty-three culturally relevant relationships are identified and formalized as a LOD property vocabulary to be used by digital curators to interlink digital collections. The results presented are provisional and a starting point to be discussed, tested, and enhanced. </p>","['cultur', 'heritag', 'institut', 'publish', 'digit', 'collect', 'web', 'lod', 'new', 'step', 'patrimoni', 'curatori', 'process', 'institut', 'mani', 'collect', 'themat', 'superimpos', 'complementari', 'frequent', 'object', 'collect', 'cultur', 'relev', 'relationship', 'book', 'paint', 'draft', 'sketch', 'famou', 'paint', 'lod', 'technolog', 'enabl', 'heritag', 'record', 'interlink', 'achiev', 'interoper', 'ad', 'valu', 'digit', 'collect', 'empow', 'heritag', 'institut', 'aim', 'research', 'character', 'cultur', 'relev', 'relationship', 'vocabulari', 'use', 'case', 'exampl', 'relationship', 'object', 'suggest', 'curat', 'mention', 'literatur', 'conceptu', 'model', 'cidoc', 'crm', 'collect', 'use', 'exampl', 'inspir', 'cultur', 'relev', 'relationship', 'relationship', 'identifi', 'compar', 'identifi', 'similar', 'mean', 'synthes', 'normal', 'thirti', 'cultur', 'relev', 'relationship', 'identifi', 'formal', 'lod', 'properti', 'vocabulari', 'use', 'digit', 'curat', 'interlink', 'digit', 'collect', 'result', 'provision', 'start', 'discuss', 'test', 'enhanc']",,,
