,new_index,Lens ID_Train,index,Abstract_Train,Abstract_trim_2_Train,Lens ID_Test,Abstract_Test,Abstract_trim_2_Test,Dickson,Andy,Bill
0,0hello,194-391-518-246-985,0,"This article is organized in 10 sections: (1) Knowledge Organization (KO) is a wide interdisciplinary field, much broader than Library and Information Science (LIS). (2) Inside LIS there have been many different approaches and traditions of KO with little mutual influence. These traditions have to a large extent been defined by new technology, for which reason the theoretical integration and underpinning has not been well considered. The most important technology-driven traditions are: a) Manual indexing and classification in libraries and reference works, b) Documentation and scientific communication, c) Information storage and retrieval by computers, d) Citation based KO and e) Full text, hypertext and Internet based approaches. These traditions taken together define very much the special LIS focus on KO. For KO as a field of research it is important to establish a fruitful theoretical frame of reference for this overall field. This paper provides some suggestions. (3) One important, theoretical distinction to consider is the one between social and intellectual forms of KO. Social forms of KO are related to professional training, disciplines and social groups while intellectual organization is related to concepts and theories in the fields to be organized. (4) The social perspective includes in addition the systems of genres and documents as well as the social system of knowledge producers, knowledge intermediaries and knowledge users. (5) This social system of documents, genres and agents makes available a very complicated structure of potential subject access points (SAPs), which may be used in information retrieval (IR). The basic aim of research in KO is to develop knowledge on how to optimise this system of SAPs and its utilization in IR. (6) SAPs may be seen as signs, and their production and use may be understood from a social semiotic point of view. (7) The concept of paradigms is also helpful because different groups and interests tend to be organized according to a paradigm and to develop different criteria of relevance, and thus different criteria of likeliness in KO. (8) The basic unit in KO is the semantic relation between two concepts, and such relations are embedded in theories. (9) In classification like things are grouped together, but what is considered similar is not a trivial question. (10) The paper concludes with the considering of methods for KO. Basically the methods of any field are connected with epistemological theories. This is also the case with KO. The existing methods as described in the literature of KO fit into a classification of basic epistemological views. The debate about the methods of KO at the deepest level therefore implies an epistemological discussion.","['articl', 'section', 'wide', 'interdisciplinari', 'much', 'broader', 'insid', 'mani', 'tradit', 'littl', 'mutual', 'influenc', 'tradit', 'larg', 'extent', 'defin', 'new', 'technolog', 'reason', 'theoret', 'integr', 'underpin', 'consid', 'import', 'technolog', 'driven', 'tradit', 'manual', 'refer', 'document', 'scientif', 'commun', 'storag', 'retriev', 'comput', 'citat', 'full', 'text', 'hypertext', 'internet', 'tradit', 'taken', 'togeth', 'defin', 'much', 'special', 'focu', 'research', 'import', 'establish', 'fruit', 'theoret', 'frame', 'refer', 'overal', 'suggest', 'import', 'theoret', 'distinct', 'consid', 'social', 'intellectu', 'form', 'social', 'form', 'relat', 'profession', 'train', 'disciplin', 'social', 'group', 'intellectu', 'relat', 'concept', 'theori', 'social', 'perspect', 'addit', 'system', 'genr', 'document', 'social', 'system', 'produc', 'intermediari', 'social', 'system', 'document', 'genr', 'agent', 'make', 'avail', 'complic', 'structur', 'potenti', 'access', 'sap', 'use', 'retriev', 'basic', 'aim', 'research', 'optimis', 'system', 'sap', 'util', 'sap', 'seen', 'sign', 'product', 'use', 'understood', 'social', 'semiot', 'view', 'concept', 'paradigm', 'help', 'group', 'interest', 'tend', 'accord', 'paradigm', 'criteria', 'relev', 'criteria', 'likeli', 'basic', 'unit', 'semant', 'relat', 'concept', 'relat', 'embed', 'theori', 'like', 'thing', 'group', 'togeth', 'consid', 'similar', 'trivial', 'question', 'conclud', 'consid', 'method', 'basic', 'method', 'connect', 'epistemolog', 'theori', 'case', 'exist', 'method', 'describ', 'literatur', 'fit', 'basic', 'epistemolog', 'view', 'debat', 'method', 'deepest', 'level', 'therefor', 'impli', 'epistemolog', 'discuss']",097-421-372-053-520,"This paper discusses some problems encountered in hypermedia-based collaboration and reuse, and presents a conceptual framework to resolve these problems. Three suggestions are made based on the discussion: 1) extra organizational structures are necessary in shared hypermedia to support collaborative interactions; 2) an abstract schema is a key to capture the dynamic nature of the shared hypermedia; 3) an integration of the schema evolution approach and the workflow approach is recommended for an open system hypermedia teamwork support. The whole authoring environment is divided into several component spaces with particular respect to the Dexter Hypertext Reference Model. Not only can this separation reduce the overall complexity of working within such an environment, but it also conforms more closely with human cognitive needs in collaborative authoring and reuse acitivites","['discuss', 'problem', 'encount', 'hypermedia', 'collabor', 'reus', 'conceptu', 'framework', 'resolv', 'problem', 'suggest', 'made', 'discuss', 'extra', 'organiz', 'structur', 'necessari', 'share', 'hypermedia', 'support', 'collabor', 'interact', 'abstract', 'schema', 'key', 'captur', 'dynam', 'natur', 'share', 'hypermedia', 'integr', 'schema', 'evolut', 'workflow', 'recommend', 'open', 'system', 'hypermedia', 'teamwork', 'support', 'whole', 'environ', 'divid', 'sever', 'compon', 'space', 'particular', 'respect', 'dexter', 'hypertext', 'refer', 'model', 'separ', 'reduc', 'overal', 'complex', 'environ', 'conform', 'close', 'human', 'cognit', 'collabor', 'reus', 'acitivit']",,,
1,1hello,014-482-297-957-834,1,"Organizing and providing access to the resources on the Internet has been a problem area in spite of the availability of sophisticated search engines and other software tools. There have been several attempts to organize the resources on the World Wide Web. Some of them have tried to use traditional library classification schemes such as the Library of Congress Classification, the Dewey Decimal Classification and others. However there is a need to assign proper subject headings to them and present them in a logical or hierarchical sequence to cater to the need for browsing. This paper attempts to describe an experimental system designed to organize and provide access to web documents using a faceted pre-coordinate indexing system based on the Deep Structure Indexing System (DSIS) derived from POPSI (Postulate based Permuted Subject Indexing) of Bhattacharyya, and the facet analysis and chain indexing system of Ranganathan. A prototype software system has been designed to create a database of records specifying Web documents according to the Dublin Core and to input a faceted subject heading according to DSIS. Synonymous terms are added to the standard terms in the heading using appropriate symbols. Once the data are entered along with a description and the URL of the web document, the record is stored in the system. More than one faceted subject heading can be assigned to a record depending on the content of the original document. The system stores the surrogates and keeps the faceted subject headings separately after establishing a link. The search is carried out on index entries derived from the faceted subject heading using the chain indexing technique. If a single term is input, the system searches for its presence in the faceted subject headings and displays the subject headings in a sorted sequence reflecting an organizing sequence. If the number of retrieved headings is too large (running into more than a page) the user has the option of entering another search term to be searched in combination. The system searches subject headings already retrieved and looks for those containing the second term. The retrieved faceted subject headings can be displayed and browsed. When the relevant subject heading is selected the system displays the records with their URLs. Using the URL, the original document on the web can be accessed. The prototype system developed in a Windows NT environment using ASP and a web server is under rigorous testing. The database and index management routines need further development.","['access', 'resourc', 'internet', 'problem', 'area', 'spite', 'avail', 'sophist', 'search', 'engin', 'softwar', 'tool', 'sever', 'attempt', 'resourc', 'world', 'wide', 'web', 'tri', 'use', 'tradit', 'scheme', 'congress', 'dewey', 'decim', 'other', 'howev', 'assign', 'proper', 'head', 'logic', 'hierarch', 'sequenc', 'cater', 'brows', 'attempt', 'describ', 'experiment', 'system', 'design', 'access', 'web', 'document', 'use', 'facet', 'coordin', 'system', 'deep', 'structur', 'system', 'deriv', 'popsi', 'postul', 'permut', 'bhattacharyya', 'facet', 'analysi', 'chain', 'system', 'ranganathan', 'prototyp', 'softwar', 'system', 'design', 'creat', 'databas', 'record', 'specifi', 'web', 'document', 'accord', 'dublin', 'core', 'input', 'facet', 'head', 'accord', 'synonym', 'ad', 'standard', 'head', 'use', 'appropri', 'symbol', 'data', 'enter', 'along', 'descript', 'url', 'web', 'document', 'record', 'store', 'system', 'facet', 'head', 'assign', 'record', 'depend', 'content', 'origin', 'document', 'system', 'store', 'surrog', 'facet', 'head', 'separ', 'establish', 'link', 'search', 'carri', 'entri', 'deriv', 'facet', 'head', 'use', 'chain', 'techniqu', 'singl', 'input', 'system', 'search', 'presenc', 'facet', 'head', 'display', 'head', 'sort', 'sequenc', 'reflect', 'sequenc', 'number', 'retriev', 'head', 'larg', 'run', 'page', 'option', 'enter', 'anoth', 'search', 'search', 'combin', 'system', 'search', 'head', 'alreadi', 'retriev', 'look', 'contain', 'second', 'retriev', 'facet', 'head', 'display', 'brows', 'relev', 'head', 'select', 'system', 'display', 'record', 'url', 'use', 'url', 'origin', 'document', 'web', 'access', 'prototyp', 'system', 'window', 'environ', 'use', 'web', 'server', 'rigor', 'test', 'databas', 'manag', 'routin']",116-509-832-503-46X,"The paper addresses the ways in which computerization and a thesaurus like the Art and Architecture Thesaurus (AAT) influence the organization, description, and understanding of the visual arts. It discusses these issues from the point of view of the AAT and considers how its structure and content serve as a bridging mechanism between the many different manifestations of the visual arts and the different types of organizations serving the viewers of art, whether as students, scholars, collections managers, or the enjoying public. This paper shows how a knowledge base like the AAT helps this variety of users develop approaches to the visual arts and suggests that the special nature of dealing with image rather than text influences how the thesaurus is structured and applied","['address', 'computer', 'thesauru', 'like', 'art', 'architectur', 'thesauru', 'influenc', 'descript', 'understand', 'visual', 'art', 'discuss', 'issu', 'view', 'consid', 'structur', 'content', 'serv', 'bridg', 'mechan', 'mani', 'manifest', 'visual', 'art', 'type', 'serv', 'viewer', 'art', 'whether', 'student', 'scholar', 'collect', 'manag', 'enjoy', 'public', 'show', 'like', 'help', 'varieti', 'visual', 'art', 'suggest', 'special', 'natur', 'deal', 'imag', 'rather', 'text', 'influenc', 'thesauru', 'structur', 'appli']",,,
2,2hello,014-482-297-957-834,2,"Organizing and providing access to the resources on the Internet has been a problem area in spite of the availability of sophisticated search engines and other software tools. There have been several attempts to organize the resources on the World Wide Web. Some of them have tried to use traditional library classification schemes such as the Library of Congress Classification, the Dewey Decimal Classification and others. However there is a need to assign proper subject headings to them and present them in a logical or hierarchical sequence to cater to the need for browsing. This paper attempts to describe an experimental system designed to organize and provide access to web documents using a faceted pre-coordinate indexing system based on the Deep Structure Indexing System (DSIS) derived from POPSI (Postulate based Permuted Subject Indexing) of Bhattacharyya, and the facet analysis and chain indexing system of Ranganathan. A prototype software system has been designed to create a database of records specifying Web documents according to the Dublin Core and to input a faceted subject heading according to DSIS. Synonymous terms are added to the standard terms in the heading using appropriate symbols. Once the data are entered along with a description and the URL of the web document, the record is stored in the system. More than one faceted subject heading can be assigned to a record depending on the content of the original document. The system stores the surrogates and keeps the faceted subject headings separately after establishing a link. The search is carried out on index entries derived from the faceted subject heading using the chain indexing technique. If a single term is input, the system searches for its presence in the faceted subject headings and displays the subject headings in a sorted sequence reflecting an organizing sequence. If the number of retrieved headings is too large (running into more than a page) the user has the option of entering another search term to be searched in combination. The system searches subject headings already retrieved and looks for those containing the second term. The retrieved faceted subject headings can be displayed and browsed. When the relevant subject heading is selected the system displays the records with their URLs. Using the URL, the original document on the web can be accessed. The prototype system developed in a Windows NT environment using ASP and a web server is under rigorous testing. The database and index management routines need further development.","['access', 'resourc', 'internet', 'problem', 'area', 'spite', 'avail', 'sophist', 'search', 'engin', 'softwar', 'tool', 'sever', 'attempt', 'resourc', 'world', 'wide', 'web', 'tri', 'use', 'tradit', 'scheme', 'congress', 'dewey', 'decim', 'other', 'howev', 'assign', 'proper', 'head', 'logic', 'hierarch', 'sequenc', 'cater', 'brows', 'attempt', 'describ', 'experiment', 'system', 'design', 'access', 'web', 'document', 'use', 'facet', 'coordin', 'system', 'deep', 'structur', 'system', 'deriv', 'popsi', 'postul', 'permut', 'bhattacharyya', 'facet', 'analysi', 'chain', 'system', 'ranganathan', 'prototyp', 'softwar', 'system', 'design', 'creat', 'databas', 'record', 'specifi', 'web', 'document', 'accord', 'dublin', 'core', 'input', 'facet', 'head', 'accord', 'synonym', 'ad', 'standard', 'head', 'use', 'appropri', 'symbol', 'data', 'enter', 'along', 'descript', 'url', 'web', 'document', 'record', 'store', 'system', 'facet', 'head', 'assign', 'record', 'depend', 'content', 'origin', 'document', 'system', 'store', 'surrog', 'facet', 'head', 'separ', 'establish', 'link', 'search', 'carri', 'entri', 'deriv', 'facet', 'head', 'use', 'chain', 'techniqu', 'singl', 'input', 'system', 'search', 'presenc', 'facet', 'head', 'display', 'head', 'sort', 'sequenc', 'reflect', 'sequenc', 'number', 'retriev', 'head', 'larg', 'run', 'page', 'option', 'enter', 'anoth', 'search', 'search', 'combin', 'system', 'search', 'head', 'alreadi', 'retriev', 'look', 'contain', 'second', 'retriev', 'facet', 'head', 'display', 'brows', 'relev', 'head', 'select', 'system', 'display', 'record', 'url', 'use', 'url', 'origin', 'document', 'web', 'access', 'prototyp', 'system', 'window', 'environ', 'use', 'web', 'server', 'rigor', 'test', 'databas', 'manag', 'routin']",043-454-317-567-459,"This article examines the main objective and subjective aspects traceable in the concepts of information, document, knowledge, knowledge organization and level of reality. The hypothesis of the author is that objective and subjective aspects are both present in each of these entities, as it is sometimes implicitly recognized even by some of the authors that usually underline exclusively the objective or the subjective elements of these entities. ""Moderate constructivism"" is the synthesis of objectivism and subjectivism that consists in recognizing that reality is neither completely ""given"" nor completely ""built"" and it constitutes (beyond too marked pseudo-oppositions) the paradigm today de facto dominant both in epistemology studies and in knowledge organization studies.","['articl', 'examin', 'main', 'object', 'aspect', 'traceabl', 'concept', 'document', 'level', 'realiti', 'hypothesi', 'object', 'aspect', 'entiti', 'sometim', 'implicitli', 'recogn', 'even', 'usual', 'underlin', 'exclus', 'object', 'element', 'entiti', 'moder', 'constructiv', 'synthesi', 'objectiv', 'subjectiv', 'consist', 'recogn', 'realiti', 'neither', 'complet', 'given', 'complet', 'built', 'constitut', 'beyond', 'mark', 'pseudo', 'opposit', 'paradigm', 'facto', 'domin', 'epistemolog']",,,
3,3hello,182-499-359-463-219,3,"The physical organisation of items on library shelves using any classification scheme is inevitably a compromise. The best efforts to achieve an arrangement char is helpful to users will be thwarted by the multifaceted nature of these items and the specific needs of the user and the library. Items on a particular subject will be scattered throughout the library building(s) across disciplines, by physical form, by frequency of use and whether and for how long they may be borrowed. Even though the rich information content of multifaceted items may be represented in the notation, the items required by a user will be scattered across library shelves when the item is placed in a single relative location. This paper explores these issues using examples from a University Library classified using the Dea ey Decimal Classification Scheme (DDC). The electronic context of the library OPAC can transcend the constraints imposed by the predominantly physical nature of library collections, yet the current use of classification schemes in on-line systems retains many of these limitations. Examples of such systems applying DDC on the World Wide Web are discussed and compared with a system that seeks to use DDC in what is called view-based searching. The interface and the resulting browsing and searching capability of a View-Based Online Public Access Catalogue (OPAC) are described. Ways in which subject. access to library collections can be improved and disciplinary scatter resolved by assigning multiple class numbers to items and exploiting the rich Dewey structure in a faceted form are discussed. It is suggested that the informative power of visual classificatory structures at the search interface will be beneficial to the broader learning experience of the user. The paper concludes that the application of classification schemes in electronic interfaces should not be bound by the physical constraints that no longer apply in an electronic context but be exploited to provide a complete, flexible and individual interface as determined by the needs of each user.","['physic', 'organis', 'item', 'shelv', 'use', 'scheme', 'inevit', 'compromis', 'best', 'effort', 'achiev', 'arrang', 'char', 'help', 'thwart', 'multifacet', 'natur', 'item', 'specif', 'item', 'particular', 'scatter', 'throughout', 'build', 'across', 'disciplin', 'physic', 'form', 'frequenc', 'use', 'whether', 'long', 'borrow', 'even', 'though', 'rich', 'content', 'multifacet', 'item', 'repres', 'notat', 'item', 'requir', 'scatter', 'across', 'shelv', 'item', 'place', 'singl', 'rel', 'locat', 'explor', 'issu', 'use', 'exampl', 'univers', 'classifi', 'use', 'decim', 'scheme', 'electron', 'context', 'opac', 'transcend', 'constraint', 'impos', 'predominantli', 'physic', 'natur', 'collect', 'current', 'use', 'scheme', 'line', 'system', 'retain', 'mani', 'limit', 'exampl', 'system', 'appli', 'world', 'wide', 'web', 'discuss', 'compar', 'system', 'seek', 'use', 'call', 'view', 'search', 'interfac', 'result', 'brows', 'search', 'capabl', 'view', 'onlin', 'public', 'access', 'catalogu', 'opac', 'describ', 'access', 'collect', 'improv', 'disciplinari', 'scatter', 'resolv', 'assign', 'multipl', 'class', 'number', 'item', 'exploit', 'rich', 'dewey', 'structur', 'facet', 'form', 'discuss', 'suggest', 'power', 'visual', 'classificatori', 'structur', 'search', 'interfac', 'benefici', 'broader', 'learn', 'experi', 'conclud', 'applic', 'scheme', 'electron', 'interfac', 'bound', 'physic', 'constraint', 'longer', 'appli', 'electron', 'context', 'exploit', 'complet', 'flexibl', 'individu', 'interfac', 'determin']",036-149-448-029-082,"The Indexing Branch of the National Agricultural Library (NAL) has launched a project to move from their traditional one-on-one method of training novice indexers to a computer-based, largely self-directed training program. CAIT, the Computer-Assisted Indexing Tutor, has been designed to standardize, streamline and improve the quality of indexer training. In addition, to support the increased need for all NAL indexers to more fully utilize microcomputers for indexing production, the Branch investigated the reinvention of paper versions of frequently used indexing tools as electronic references.","['branch', 'nation', 'agricultur', 'nal', 'launch', 'project', 'move', 'tradit', 'method', 'train', 'novic', 'comput', 'larg', 'self', 'direct', 'train', 'program', 'cait', 'comput', 'assist', 'tutor', 'design', 'standard', 'streamlin', 'improv', 'qualiti', 'train', 'addit', 'support', 'increas', 'nal', 'fulli', 'util', 'microcomput', 'product', 'branch', 'investig', 'reinvent', 'version', 'frequent', 'use', 'tool', 'electron', 'refer']",,,
